site,country,title,price_jpy,review_count,seller_badge,search_position,monthly_sold_count,is_bestseller,bestseller_rank,validity,usage_validity,activation_validity,network_type,carrier_support_local,carrier_support_kr,data_amount,product_url,asin,site_product_id,seller,brand,evidence
amazon_jp,tw,【台湾 eSIM】4日間（96時間）高速データ無制限 出発前のお試しに便利 日本国内500MB付き データ通信専用（電話番号なし）5G / 4G対応 即日発行可能 年中無休·24時間サポート【mewfi eSIM】,1680,16,,,,,1405,4일,4일,90일,roaming,"{""chunghwa"": true, ""taiwan_mobile"": null, ""fareastone"": null}","{""skt"": null, ""kt"": null, ""lgu"": null}",unlimited,https://www.amazon.co.jp/eSIM%E3%80%914%E6%97%A5%E9%96%93%EF%BC%8896%E6%99%82%E9%96%93%EF%BC%89%E9%AB%98%E9%80%9F%E3%83%87%E3%83%BC%E3%82%BF%E7%84%A1%E5%88%B6%E9%99%90-%E5%87%BA%E7%99%BA%E5%89%8D%E3%81%AE%E3%81%8A%E8%A9%A6%E3%81%97%E3%81%AB%E4%BE%BF%E5%88%A9-%E6%97%A5%E6%9C%AC%E5%9B%BD%E5%86%85500MB%E4%BB%98%E3%81%8D-%E3%83%87%E3%83%BC%E3%82%BF%E9%80%9A%E4%BF%A1%E5%B0%82%E7%94%A8%EF%BC%88%E9%9B%BB%E8%A9%B1%E7%95%AA%E5%8F%B7%E3%81%AA%E3%81%97%EF%BC%895G-%E5%B9%B4%E4%B8%AD%E7%84%A1%E4%BC%91%C2%B724%E6%99%82%E9%96%93%E3%82%B5%E3%83%9D%E3%83%BC%E3%83%88%E3%80%90mewfi/dp/B0GSD8DV3J,B0GSD8DV3J,B0GSD8DV3J,Mewfi 正規販売店,mewfiのストアを表示,"{""price_jpy"": [""￥1,680""], ""usage_validity"": [""【台湾 eSIM】4日間（96時間）高速データ無制限 出発前のお試しに便利 日本国内500MB付き データ通信専用（電話番号なし）5G / 4G対応 即日発行可能 年中無休·24時間サポート【mewfi eSIM】""], ""activation_validity"": [""【有効期限】eSIM情報が記載されたメールの受信日から90日以内にご利用ください。""], ""data_amount"": [""【台湾 eSIM】利用期間中、高速データ通信を無制限でご利用いただけます。1日ごとのデータ容量上限はありません。ChatGPT、TikTok、SNS、Google マップなど、幅広いアプリ利用に対応しています。""], ""network_type"": [""【DeSiM】台湾15日間無制限+eSIMテストサービス付き【セット】 | 海外旅行出国前事前テストeSIMサービス - DeSiM - 渡航前の不安を解消！ | Wi-Fi使用が面倒、ローミング料金が高い、SIMやeSIMの設定が不安な方に V4"", ""【DeSiM】台湾8日間無制限+eSIMテストサービス付き【セット】 | 海外旅行出国前事前テストeSIMサービス - DeSiM - 渡航前の不安を解消！ | Wi-Fi使用が面倒、ローミング料金が高い、SIMやeSIMの設定が不安な方に V4"", ""score: local=0, roaming=2""], ""carrier_support_local"": [""Chunghwa Telecom: 【台湾 SIM】3日間 (72時間) 高速データ通信無制限 5G/4G 中華電信回線 simフリー端末のみ対応 ピン付き 台湾 simカード (3日間)""], ""review_count"": [""detail_page: (16)""], ""bestseller_rank"": [""Amazon 売れ筋ランキング 家電＆カメラ - 159,762位 ( 家電＆カメラの売れ筋ランキングを見る ) プリペイドSIMカード - 1,405位""], ""title"": [""【台湾 eSIM】4日間（96時間）高速データ無制限 出発前のお試しに便利 日本国内500MB付き データ通信専用（電話番号なし）5G / 4G対応 即日発行可能 年中無休·24時間サポート【mewfi eSIM】""]}"
amazon_jp,tw,【台湾eSIM】14日間 10GB（十三泊十四日 コスパ重視） DeSiM正規卸 | LINE相談受付中｜データ通信専用（電話番号なし） | simフリー端末のみ対応 説明書付 イーシム desim,2268,733,,,,,952,3일,3일,14일,local,"{""chunghwa"": true, ""taiwan_mobile"": null, ""fareastone"": null}","{""skt"": null, ""kt"": null, ""lgu"": null}",unlimited,https://www.amazon.co.jp/%E3%80%90%E5%8F%B0%E6%B9%BEeSIM%E3%80%9114%E6%97%A5%E9%96%93-10GB%EF%BC%88%E5%8D%81%E4%B8%89%E6%B3%8A%E5%8D%81%E5%9B%9B%E6%97%A5-DeSiM%E6%AD%A3%E8%A6%8F%E5%8D%B8-LINE%E7%9B%B8%E8%AB%87%E5%8F%97%E4%BB%98%E4%B8%AD%EF%BD%9C%E3%83%87%E3%83%BC%E3%82%BF%E9%80%9A%E4%BF%A1%E5%B0%82%E7%94%A8%EF%BC%88%E9%9B%BB%E8%A9%B1%E7%95%AA%E5%8F%B7%E3%81%AA%E3%81%97%EF%BC%89-sim%E3%83%95%E3%83%AA%E3%83%BC%E7%AB%AF%E6%9C%AB%E3%81%AE%E3%81%BF%E5%AF%BE%E5%BF%9C/dp/B0DNZ13K27,B0DNZ13K27,B0DNZ13K27,DeSiM,DeSiMのストアを表示,"{""price_jpy"": [""￥2,268""], ""usage_validity"": [""【SKTelecoｍ公式認証】 韓国eSIM 3日間 (72時間) 電話番号付き 超高速データ無制限 最初の5分発信無料(韓国国内) お急ぎの方即時発行可(LINE相談受付中) 有効期限／ご購入日より120日以内 現地空港サポート(SKTelecomローミングセンター) SKテレコム正規品 韓国SIMカードタイプではありません""], ""activation_validity"": [""【台湾eSIM】14日間 10GB（十三泊十四日 コスパ重視） DeSiM正規卸 | LINE相談受付中｜データ通信専用（電話番号なし） | simフリー端末のみ対応 説明書付 イーシム desim""], ""data_amount"": [""商品の説明 購入前の注意事項 【注意事項】 注意事項①：電話番号は付与されませんので、ご注意ください。 注意事項②：SIMロックフリー端末、もしくはSIMフリー端末専用のサービスです。必ず、ご利用端末がeSIM対応かどうかご確認ください。 注意事項③：2021年10月1日以前にSIMロック解除をキャリア店頭またはインターネットでされた「Android端末」は""], ""network_type"": [""商品の説明 購入前の注意事項 【注意事項】 注意事項①：電話番号は付与されませんので、ご注意ください。 注意事項②：SIMロックフリー端末、もしくはSIMフリー端末専用のサービスです。必ず、ご利用端末がeSIM対応かどうかご確認ください。 注意事項③：2021年10月1日以前にSIMロック解除をキャリア店頭またはインターネットでされた「Android端末」は"", ""【チョコSIM 定額（Sプラン）】【中国の電話番号付きでアプリや施設サービスのSMS認証が可能】【データ容量】合計500MB/月【音声】合計20分間/月 データ/音声/SMS付きSIMカード 中国SIM マカオSIM China unicom ※こちらのSIMカードは契約後、毎月の基本料が発生いたします。※2024年11月1日から台湾でのご利用はできなくなり"", ""score: local=9, roaming=1""], ""carrier_support_local"": [""Chunghwa Telecom: 【台湾eSIM】 5日間 高速データ無制限（低速なし）使い放題 実名登録不要 台湾SIMカード｜Chunghwa Telecom公式認証 台湾e-sim sim プリペイドSIM｜即日発行 LINE相談受付中｜TikTokとChatGPTとテザリング対応"", ""Chunghwa Telecom: 【台湾eSIM】 5日間 高速データ無制限（低速なし）使い放題 実名登録不要 台湾SIMカード｜Chunghwa Telecom公式認証 台湾e-sim sim プリペイドSIM｜即日発行 LINE相談受付中｜TikTokとChatGPTとテザリング対応""], ""review_count"": [""detail_page: 733""], ""bestseller_rank"": [""Amazon 売れ筋ランキング 家電＆カメラ - 95,582位 ( 家電＆カメラの売れ筋ランキングを見る ) プリペイドSIMカード - 952位""], ""title"": [""【台湾eSIM】14日間 10GB（十三泊十四日 コスパ重視） DeSiM正規卸 | LINE相談受付中｜データ通信専用（電話番号なし） | simフリー端末のみ対応 説明書付 イーシム desim""]}"
amazon_jp,tw,台湾 eSIM 3日間 (72時間) 完全無制限 TiktokとChatGPT対応 4G-LTE 高速データ 使い放題 当日発行可能 説明書付 LINEで24時間サポート 台湾 sim MEWMEWホーム,1280,9,,,,,964,3일,3일,90일,unknown,"{""chunghwa"": true, ""taiwan_mobile"": true, ""fareastone"": null}","{""skt"": null, ""kt"": null, ""lgu"": null}",unlimited,https://www.amazon.co.jp/eSIM-Tiktok%E3%81%A8ChatGPT%E5%AF%BE%E5%BF%9C-4G-LTE-LINE%E3%81%A724%E6%99%82%E9%96%93%E3%82%B5%E3%83%9D%E3%83%BC%E3%83%88-MEWMEW%E3%83%9B%E3%83%BC%E3%83%A0/dp/B0DX1HQ71D,B0DX1HQ71D,B0DX1HQ71D,mewmewホーム eSIM,ＭＥＷＭＥＷホームのストアを表示,"{""price_jpy"": [""￥1,280""], ""usage_validity"": [""台湾 eSIM 3日間 (72時間) 完全無制限 TiktokとChatGPT対応 4G-LTE 高速データ 使い放題 当日発行可能 説明書付 LINEで24時間サポート 台湾 sim MEWMEWホーム""], ""activation_validity"": [""📍【有効期限】eSIMはQRコードを受け取ってから90日以内は有効になっています。eSIMプランの日数は24時間を一日とカウントされます。""], ""data_amount"": [""📍5G/4G/LTEに対応し、高速データ通信量は完全無制限となります。※データ通信専用、電話番号なし""], ""network_type"": [""local_signal: 【チョコSIM 定額（Sプラン）】【中国の電話番号付きでアプリや施設サービスのSMS認証が可能】【データ容量】合計500MB/月【音声】合計20分間/月 データ/音声/SMS付きSIMカード 中国SIM マカオSIM China unicom ※こちらのSIMカードは契約後、毎月の基本料が発生いたします。※2024年11月1日から台湾でのご利用はできなくなり"", ""roaming_signal: 【DeSiM】台湾2日間無制限+eSIMテストサービス付き【セット】 | 海外旅行出国前事前テストeSIMサービス - DeSiM - 渡航前の不安を解消！ | Wi-Fi使用が面倒、ローミング料金が高い、SIMやeSIMの設定が不安な方に V4"", ""insufficient_or_conflicting_signals(local=6, roaming=2)""], ""carrier_support_local"": [""Taiwan Mobile: サービスプロバイダ 台灣大哥大 (Taiwan Mobile)"", ""Chunghwa Telecom: 【台湾eSIM】 5日間 高速データ無制限（低速なし）使い放題 実名登録不要 台湾SIMカード｜Chunghwa Telecom公式認証 台湾e-sim sim プリペイドSIM｜即日発行 LINE相談受付中｜TikTokとChatGPTとテザリング対応"", ""Chunghwa Telecom: 【台湾eSIM】4日間完全無制限 高速データ通信（低速なし）5G/4G-LTE 使い放題 実名登録不要 中華電信正規台湾SIM eSIM プリペイドSIM esim taiwan sim ｜当日発行可能｜TikTok·ChatGPT·テザリング対応 ｜台北 高雄 桃園｜旅行・出張・留学"", ""Chunghwa Telecom: 【台湾eSIM】 4日間 高速データ無制限（低速なし）使い放題 実名登録不要 台湾SIMカード｜Chunghwa Telecom公式認証 台湾e-sim sim プリペイドSIM｜即日発行 LINE相談受付中｜TikTokとChatGPTとテザリング対応"", ""Chunghwa Telecom: 【台湾eSIM】4日間完全無制限 高速データ通信（低速なし）5G/4G-LTE 使い放題 実名登録不要 中華電信正規台湾SIM eSIM プリペイドSIM esim taiwan sim ｜当日発行可能｜TikTok·ChatGPT·テザリング対応 ｜台北 高雄 桃園｜旅行・出張・留学"", ""Taiwan Mobile: Amazon.co.jp: 台湾 eSIM 3日間 (72時間) 完全無制限 TiktokとChatGPT対応 4G-LTE 高速データ 使い放題 当日発行可能 説明書付 LINEで24時間サポート 台湾 sim MEWMEWホーム : 家電＆カメラ 次に移動 メインコンテンツ この商品について こ""], ""review_count"": [""detail_page: (9)""], ""bestseller_rank"": [""Amazon 売れ筋ランキング 家電＆カメラ - 97,323位 ( 家電＆カメラの売れ筋ランキングを見る ) プリペイドSIMカード - 964位""], ""title"": [""台湾 eSIM 3日間 (72時間) 完全無制限 TiktokとChatGPT対応 4G-LTE 高速データ 使い放題 当日発行可能 説明書付 LINEで24時間サポート 台湾 sim MEWMEWホーム""]}"
amazon_jp,tw,台湾SIMカード 3日間 (72時間) 使い放題 4G/5G簡単設定 Tiktok対応 中華電信利用で安定通信 日本語説明書付き SIMフリー対応 台湾 プリペイドSIMカード 台湾 sim ※Galaxyシリーズ端末非対応 MEWMEWホーム,1480,14,,,,,1273,3일,3일,3일,unknown,"{""chunghwa"": true, ""taiwan_mobile"": null, ""fareastone"": null}","{""skt"": null, ""kt"": null, ""lgu"": null}",unlimited,https://www.amazon.co.jp/3%E6%97%A5%E9%96%93-%E4%B8%AD%E8%8F%AF%E9%9B%BB%E4%BF%A1%E5%88%A9%E7%94%A8%E3%81%A7%E5%AE%89%E5%AE%9A%E9%80%9A%E4%BF%A1-%E3%83%97%E3%83%AA%E3%83%9A%E3%82%A4%E3%83%89SIM%E3%82%AB%E3%83%BC%E3%83%89-%E2%80%BBGalaxy%E3%82%B7%E3%83%AA%E3%83%BC%E3%82%BA%E7%AB%AF%E6%9C%AB%E9%9D%9E%E5%AF%BE%E5%BF%9C-MEWMEW%E3%83%9B%E3%83%BC%E3%83%A0/dp/B0F5B827J1,B0F5B827J1,B0F5B827J1,mewmewホーム eSIM,ＭＥＷＭＥＷホームのストアを表示,"{""price_jpy"": [""￥1,480""], ""usage_validity"": [""台湾SIMカード 3日間 (72時間) 使い放題 4G/5G簡単設定 Tiktok対応 中華電信利用で安定通信 日本語説明書付き SIMフリー対応 台湾 プリペイドSIMカード 台湾 sim ※Galaxyシリーズ端末非対応 MEWMEWホーム""], ""activation_validity"": [""【SKTelecoｍ公式認証】 韓国eSIM 3日間 (72時間) 電話番号付き 超高速データ無制限 最初の5分発信無料(韓国国内) お急ぎの方即時発行可(LINE相談受付中) 有効期限／ご購入日より120日以内 現地空港サポート(SKTelecomローミングセンター) SKテレコム正規品 韓国SIMカードタイプではありません""], ""data_amount"": [""【データ通信無制限＆高速回線】台湾全土で高速5G/4Gデータ通信が無制限で利用可能！面倒な契約や手続きは一切不要、簡単に開通予約すれば使えるプリペイドSIMです。日本でよく使われるアプリは、台湾でもそのままご利用可能！TikTokもガンガン使える！""], ""network_type"": [""local_signal: 【チョコSIM 定額（Sプラン）】【中国の電話番号付きでアプリや施設サービスのSMS認証が可能】【データ容量】合計500MB/月【音声】合計20分間/月 データ/音声/SMS付きSIMカード 中国SIM マカオSIM China unicom ※こちらのSIMカードは契約後、毎月の基本料が発生いたします。※2024年11月1日から台湾でのご利用はできなくなり"", ""roaming_signal: 台湾4G/5G LTE プリペイドSIMカード - 2GB高速データ、旅行用3日間無制限ローミング (即時アクティベーション)"", ""insufficient_or_conflicting_signals(local=6, roaming=2)""], ""carrier_support_local"": [""Chunghwa Telecom: 【安心のCHT回線で広範囲カバー】台湾で大手通信会社中華電信(CHT )のネットワークを使用。台北や高雄などの都市部はもちろん、地方でも安定した通信を実現！"", ""Chunghwa Telecom: ・データ容量: 無制限 ・回線: 中華電信 ・SIMサイズ: 3in1（標準SIM / マイクロSIM / ナノSIM） ・サポート: 24時間日本語カスタマーサービス ・プラン: 2日間 / 3日間 / 4日間 / 5日間から選択可能 台湾旅行を快適にする「台湾物理カード（SIMカード）」！データ"", ""Chunghwa Telecom: サービスプロバイダ 中華電信"", ""Chunghwa Telecom: Amazon.co.jp: 台湾SIMカード 3日間 (72時間) 使い放題 4G/5G簡単設定 Tiktok対応 中華電信利用で安定通信 日本語説明書付き SIMフリー対応 台湾 プリペイドSIMカード 台湾 sim ※Galaxyシリーズ端末非対応 MEWMEWホーム : 家電＆カメラ"", ""Chunghwa Telecom: 台湾SIMカード 3日間 (72時間) 使い放題 4G/5G簡単設定 Tiktok対応 中華電信利用で安定通信 日本語説明書付き SIMフリー対応 台湾 プリペイドSIMカード 台湾 sim ※Galaxyシリーズ端末非対応 MEWMEWホーム"", ""Chunghwa Telecom: 【台湾eSIM】3日間完全無制限 高速データ通信（低速なし）5G/4G-LTE 使い放題 実名登録不要 中華電信正規台湾SIM eSIM プリペイドSIM esim taiwan sim ｜当日発行可能｜TikTok·ChatGPT·テザリング対応"", ""Chunghwa Telecom: 【台湾eSIM】4日間完全無制限 高速データ通信（低速なし）5G/4G-LTE 使い放題 実名登録不要 中華電信正規台湾SIM eSIM プリペイドSIM esim taiwan sim ｜当日発行可能｜TikTok·ChatGPT·テザリング対応 ｜台北 高雄 桃園｜旅行・出張・留学"", ""Chunghwa Telecom: 【台湾eSIM】3日間完全無制限 高速データ通信（低速なし）5G/4G-LTE 使い放題 実名登録不要 中華電信正規台湾SIM eSIM プリペイドSIM esim taiwan sim ｜当日発行可能｜TikTok·ChatGPT·テザリング対応"", ""Chunghwa Telecom: 台湾SIMカード 4日間 (96時間) 使い放題 4G/5G簡単設定 TiktokとChatGPT対応 中華電信利用で安定通信 日本語説明書付き SIMフリー対応 プリペイドSIMカード ※Galaxyシリーズ端末非対応 台湾 sim 4日"", ""Chunghwa Telecom: 台湾SIMカード 3日間 (72時間) 使い放題 4G/5G簡単設定 Tiktok対応 中華電信利用で安定通信 日本語説明書付き SIMフリー対応 台湾 プリペイドSIMカード 台湾 sim ※Galaxyシリーズ端末非対応 MEWMEWホーム"", ""Chunghwa Telecom: 【台湾eSIM】4日間完全無制限 高速データ通信（低速なし）5G/4G-LTE 使い放題 実名登録不要 中華電信正規台湾SIM eSIM プリペイドSIM esim taiwan sim ｜当日発行可能｜TikTok·ChatGPT·テザリング対応 ｜台北 高雄 桃園｜旅行・出張・留学"", ""Chunghwa Telecom: 台湾SIMカード 3日間 (72時間) 使い放題 4G/5G簡単設定 Tiktok対応 中華電信利用で安定通信 日本語説明書付き SIMフリー対応 台湾 プリペイドSIMカード 台湾 sim ※Galaxyシリーズ端末非対応 MEWMEWホーム"", ""Chunghwa Telecom: Amazon.co.jp: 台湾SIMカード 3日間 (72時間) 使い放題 4G/5G簡単設定 Tiktok対応 中華電信利用で安定通信 日本語説明書付き SIMフリー対応 台湾 プリペイドSIMカード 台湾 sim ※Galaxyシリーズ端末非対応 MEWMEWホーム : 家電＆カメラ 次に移動""], ""review_count"": [""detail_page: (14)""], ""bestseller_rank"": [""Amazon 売れ筋ランキング 家電＆カメラ - 142,395位 ( 家電＆カメラの売れ筋ランキングを見る ) プリペイドSIMカード - 1,273位""], ""title"": [""台湾SIMカード 3日間 (72時間) 使い放題 4G/5G簡単設定 Tiktok対応 中華電信利用で安定通信 日本語説明書付き SIMフリー対応 台湾 プリペイドSIMカード 台湾 sim ※Galaxyシリーズ端末非対応 MEWMEWホーム""]}"
amazon_jp,tw,台湾sim 7日 高速2GB/日 4G-LTE 安定な高速データ通信 低速無制限使い放題 台湾プリペイドSIM 高速データ通信 mewfi,1550,212,,,,,992,1일,1일,7일,unknown,"{""chunghwa"": true, ""taiwan_mobile"": null, ""fareastone"": null}","{""skt"": null, ""kt"": null, ""lgu"": null}",unlimited,https://www.amazon.co.jp/%E5%AE%89%E5%AE%9A%E3%81%AA%E9%AB%98%E9%80%9F%E3%83%87%E3%83%BC%E3%82%BF%E9%80%9A%E4%BF%A1-%E4%BD%8E%E9%80%9F%E7%84%A1%E5%88%B6%E9%99%90%E4%BD%BF%E3%81%84%E6%94%BE%E9%A1%8C-%E5%8F%B0%E6%B9%BE%E3%83%97%E3%83%AA%E3%83%9A%E3%82%A4%E3%83%89SIM-%E9%AB%98%E9%80%9F%E3%83%87%E3%83%BC%E3%82%BF%E9%80%9A%E4%BF%A1-mewfi/dp/B0BM7J47VF,B0BM7J47VF,B0BM7J47VF,Mewfi 正規販売店,mewfiのストアを表示,"{""price_jpy"": [""￥1,550""], ""usage_validity"": [""【対応端末条件】SIMカード有効期限2026年1月1日。商品を利用出来るのはSIMフリー スマートフォン・タブレットとなりますので、 SIMロックされている機器はご利用できません。HUAWEIシリーズ、Galaxyシリーズ、ソニーXPERIA XZ1は該当SIMカードの対応外機種です。。""], ""activation_validity"": [""台湾sim 7日 高速2GB/日 4G-LTE 安定な高速データ通信 低速無制限使い放題 台湾プリペイドSIM 高速データ通信 mewfi""], ""data_amount"": [""【安定した高速通信】台湾で7日間、4G高速データ通信を使い放題で利用できるプリペイドSIMカード。データ容量無制限。ただしデータ一日使用量が2GBに達すると最大通信速度が256kbpsに低下します。翌日の現地時間0時自動的にスピード制限を解除します。""], ""network_type"": [""local_signal: 【チョコSIM 定額（Sプラン）】【中国の電話番号付きでアプリや施設サービスのSMS認証が可能】【データ容量】合計500MB/月【音声】合計20分間/月 データ/音声/SMS付きSIMカード 中国SIM マカオSIM China unicom ※こちらのSIMカードは契約後、毎月の基本料が発生いたします。※2024年11月1日から台湾でのご利用はできなくなり"", ""roaming_signal: 【注意】APNはmobileです。台湾に到着後、自動的にインターネットに接続できない場合は、携帯電話のAPNを設定し、ローミング機能をオンにしてください。"", ""insufficient_or_conflicting_signals(local=6, roaming=7)""], ""carrier_support_local"": [""Chunghwa Telecom: 【台湾eSIM】4日間完全無制限 高速データ通信（低速なし）5G/4G-LTE 使い放題 実名登録不要 中華電信正規台湾SIM eSIM プリペイドSIM esim taiwan sim ｜当日発行可能｜TikTok·ChatGPT·テザリング対応 ｜台北 高雄 桃園｜旅行・出張・留学"", ""Chunghwa Telecom: 【台湾eSIM】4日間完全無制限 高速データ通信（低速なし）5G/4G-LTE 使い放題 実名登録不要 中華電信正規台湾SIM eSIM プリペイドSIM esim taiwan sim ｜当日発行可能｜TikTok·ChatGPT·テザリング対応 ｜台北 高雄 桃園｜旅行・出張・留学"", ""Chunghwa Telecom: 【台湾eSIM】4日間完全無制限 高速データ通信（低速なし）5G/4G-LTE 使い放題 実名登録不要 中華電信正規台湾SIM eSIM プリペイドSIM esim taiwan sim ｜当日発行可能｜TikTok·ChatGPT·テザリング対応 ｜台北 高雄 桃園｜旅行・出張・留学""], ""review_count"": [""detail_page: (212)""], ""bestseller_rank"": [""Amazon 売れ筋ランキング 家電＆カメラ - 104,226位 ( 家電＆カメラの売れ筋ランキングを見る ) プリペイドSIMカード - 992位""], ""title"": [""台湾sim 7日 高速2GB/日 4G-LTE 安定な高速データ通信 低速無制限使い放題 台湾プリペイドSIM 高速データ通信 mewfi""]}"
amazon_jp,tw,東南アジア5ヵ国周遊SIM 利用期間 8日 データ容量5GB 4Gデータ通信 プリペイドSIM ローミングSIM インドネシア・シンガポール・タイ・ベトナム・マレーシア,1299,269,,,,,499,1일,1일,8일,unknown,"{""chunghwa"": null, ""taiwan_mobile"": null, ""fareastone"": null}","{""skt"": null, ""kt"": null, ""lgu"": null}",5GB,https://www.amazon.co.jp/%E6%9D%B1%E5%8D%97%E3%82%A2%E3%82%B8%E3%82%A26%E3%83%B5%E5%9B%BD%E5%91%A8%E9%81%8ASIM-%E3%83%87%E3%83%BC%E3%82%BF%E5%AE%B9%E9%87%8F5GB-%E3%83%97%E3%83%AA%E3%83%9A%E3%82%A4%E3%83%89SIM-SIM-%E3%82%A4%E3%83%B3%E3%83%89%E3%83%8D%E3%82%B7%E3%82%A2%E3%83%BB%E3%82%AB%E3%83%B3%E3%83%9C%E3%82%B8%E3%82%A2%E3%83%BB%E3%82%B7%E3%83%B3%E3%82%AC%E3%83%9D%E3%83%BC%E3%83%AB%E3%83%BB%E3%82%BF%E3%82%A4%E3%83%BB%E3%83%9E%E3%83%AC%E3%83%BC%E3%82%B7%E3%82%A2%E3%83%BB%E3%83%99%E3%83%88%E3%83%8A%E3%83%A0/dp/B0BXT5DZ96,B0BXT5DZ96,B0BXT5DZ96,ブランド: Wise SIM,ブランド: Wise SIM,"{""price_jpy"": [""価格 ￥1,299 ￥1,880 ￥1,501 ￥1,980 ￥1,501""], ""usage_validity"": [""■SIMカード有効期限：2026年9月末まで。 【アジア5ヶ国にてデータ通信】 インドネシア、シンガポール、タイ、ベトナム、マレーシア5ヶ国にてデータ利用が可能です。1枚のSIMで周遊利用が出来るので都度差し替える事無く便利です。 【データ容量】 ４Ｇ高速データ通信が5GB利用可能です。 ※上限後、128kbpsへ速度低下となりますが期限迄は止まる事無く通信""], ""activation_validity"": [""東南アジア5ヵ国周遊SIM 利用期間 8日 データ容量5GB 4Gデータ通信 プリペイドSIM ローミングSIM インドネシア・シンガポール・タイ・ベトナム・マレーシア""], ""data_amount"": [""【データ容量】４Ｇ高速データ通信が5GB利用可能です。※上限後、128kbpsへ速度低下となりますが期限迄は止まる事無く通信利用が可能です。""], ""network_type"": [""local_signal: 【チョコSIM 定額（Sプラン）】【中国の電話番号付きでアプリや施設サービスのSMS認証が可能】【データ容量】合計500MB/月【音声】合計20分間/月 データ/音声/SMS付きSIMカード 中国SIM マカオSIM China unicom ※こちらのSIMカードは契約後、毎月の基本料が発生いたします。※2024年11月1日から台湾でのご利用はできなくなり"", ""roaming_signal: 東南アジア5ヵ国周遊SIM 利用期間 8日 データ容量5GB 4Gデータ通信 プリペイドSIM ローミングSIM インドネシア・シンガポール・タイ・ベトナム・マレーシア"", ""insufficient_or_conflicting_signals(local=6, roaming=14)""], ""review_count"": [""detail_page: (269)""], ""bestseller_rank"": [""Amazon 売れ筋ランキング 家電＆カメラ - 39,603位 ( 家電＆カメラの売れ筋ランキングを見る ) プリペイドSIMカード - 499位""], ""title"": [""東南アジア5ヵ国周遊SIM 利用期間 8日 データ容量5GB 4Gデータ通信 プリペイドSIM ローミングSIM インドネシア・シンガポール・タイ・ベトナム・マレーシア""]}"
