site,country,title,price_jpy,review_count,seller_badge,search_position,monthly_sold_count,is_bestseller,bestseller_rank,validity,usage_validity,activation_validity,network_type,carrier_support_local,carrier_support_kr,data_amount,product_url,asin,site_product_id,seller,brand,evidence
amazon_jp,tw,台湾SIM 2日間 (48時間) 無制限データ｜公式キャリア回線｜本人確認不要｜5G/4G 高速通信｜データ通信専用｜プリペイドSIM 台湾sim (2日間),990,5,,,,,520,2일,2일,2일,unknown,"{""chunghwa"": true, ""taiwan_mobile"": null, ""fareastone"": null}","{""skt"": null, ""kt"": null, ""lgu"": null}",unlimited,https://www.amazon.co.jp/%E5%8F%B0%E6%B9%BESIM-48%E6%99%82%E9%96%93-%E7%84%A1%E5%88%B6%E9%99%90%E3%83%87%E3%83%BC%E3%82%BF%EF%BD%9C%E5%85%AC%E5%BC%8F%E3%82%AD%E3%83%A3%E3%83%AA%E3%82%A2%E5%9B%9E%E7%B7%9A%EF%BD%9C%E6%9C%AC%E4%BA%BA%E7%A2%BA%E8%AA%8D%E4%B8%8D%E8%A6%81%EF%BD%9C5G-%E9%AB%98%E9%80%9F%E9%80%9A%E4%BF%A1%EF%BD%9C%E3%83%87%E3%83%BC%E3%82%BF%E9%80%9A%E4%BF%A1%E5%B0%82%E7%94%A8%EF%BD%9C%E3%83%97%E3%83%AA%E3%83%9A%E3%82%A4%E3%83%89SIM-%E5%8F%B0%E6%B9%BEsim/dp/B0GVSKCBZ8,B0GVSKCBZ8,B0GVSKCBZ8,mewmewホーム eSIM,ＭＥＷＭＥＷホームのストアを表示,"{""price_jpy"": [""￥990""], ""usage_validity"": [""台湾SIM 2日間 (48時間) 無制限データ｜公式キャリア回線｜本人確認不要｜5G/4G 高速通信｜データ通信専用｜プリペイドSIM 台湾sim (2日間)""], ""activation_validity"": [""【有効期限】SIMカードは2027年3月2日まで有効（未使用時）""], ""data_amount"": [""【高速データ完全無制限】台湾全土で利用可能なデータ通信専用プリペイドSIM。中華電信回線を採用し、広範囲で安定した高速通信を実現。データ完全無制限、速度制限なし！""], ""network_type"": [""no_local_or_roaming_keyword_matched""], ""carrier_support_local"": [""Chunghwa Telecom: 【高速データ完全無制限】台湾全土で利用可能なデータ通信専用プリペイドSIM。中華電信回線を採用し、広範囲で安定した高速通信を実現。データ完全無制限、速度制限なし！"", ""Chunghwa Telecom: 台湾全土で利用可能なデータ通信専用プリペイドSIM。 中華電信回線を採用し、広範囲で安定した高速通信を実現。データ完全無制限、速度制限なし！ 利用開始から24時間ごとに1日カウント！ 当日23:59リセットではないため、到着時間に関係なくフルに使えて無駄なし。 TikTok・ChatGPTなどのアプ"", ""Chunghwa Telecom: Amazon.co.jp: 台湾SIM 2日間 (48時間) 無制限データ｜公式キャリア回線｜本人確認不要｜5G/4G 高速通信｜データ通信専用｜プリペイドSIM 台湾sim (2日間) : 家電＆カメラ 次に移動 メインコンテンツ この商品について この商品について この商品について 購入オプショ""], ""review_count"": [""detail_page: (5)""], ""bestseller_rank"": [""Amazon 売れ筋ランキング 家電＆カメラ - 41,614位 ( 家電＆カメラの売れ筋ランキングを見る ) プリペイドSIMカード - 520位""], ""title"": [""台湾SIM 2日間 (48時間) 無制限データ｜公式キャリア回線｜本人確認不要｜5G/4G 高速通信｜データ通信専用｜プリペイドSIM 台湾sim (2日間)""]}"
amazon_jp,tw,【台湾eSIM】4日間 5GB（三泊四日 コスパ重視） DeSiM正規卸 | LINE相談受付中｜データ通信専用（電話番号なし） | simフリー端末のみ対応 説明書付 イーシム DeSiM,1308,9,,,,,1101,3일,3일,4일,local,"{""chunghwa"": true, ""taiwan_mobile"": null, ""fareastone"": null}","{""skt"": null, ""kt"": null, ""lgu"": null}",unlimited,https://www.amazon.co.jp/%E3%80%90%E5%8F%B0%E6%B9%BEeSIM%E3%80%914%E6%97%A5%E9%96%93-5GB%EF%BC%88%E4%B8%89%E6%B3%8A%E5%9B%9B%E6%97%A5-LINE%E7%9B%B8%E8%AB%87%E5%8F%97%E4%BB%98%E4%B8%AD%EF%BD%9C%E3%83%87%E3%83%BC%E3%82%BF%E9%80%9A%E4%BF%A1%E5%B0%82%E7%94%A8%EF%BC%88%E9%9B%BB%E8%A9%B1%E7%95%AA%E5%8F%B7%E3%81%AA%E3%81%97%EF%BC%89-sim%E3%83%95%E3%83%AA%E3%83%BC%E7%AB%AF%E6%9C%AB%E3%81%AE%E3%81%BF%E5%AF%BE%E5%BF%9C-DeSiM/dp/B0DNFDM7PJ,B0DNFDM7PJ,B0DNFDM7PJ,DeSiM,DeSiMのストアを表示,"{""price_jpy"": [""￥1,308""], ""usage_validity"": [""【SKTelecoｍ公式認証】 韓国eSIM 3日間 (72時間) 電話番号付き 超高速データ無制限 最初の5分発信無料(韓国国内) お急ぎの方即時発行可(LINE相談受付中) 有効期限／ご購入日より120日以内 現地空港サポート(SKTelecomローミングセンター) SKテレコム正規品 韓国SIMカードタイプではありません""], ""activation_validity"": [""【台湾eSIM】4日間 5GB（三泊四日 コスパ重視） DeSiM正規卸 | LINE相談受付中｜データ通信専用（電話番号なし） | simフリー端末のみ対応 説明書付 イーシム DeSiM""], ""data_amount"": [""商品の説明 購入前の注意事項 【注意事項】 注意事項①：電話番号は付与されませんので、ご注意ください。 注意事項②：SIMロックフリー端末、もしくはSIMフリー端末専用のサービスです。必ず、ご利用端末がeSIM対応かどうかご確認ください。 注意事項③：2021年10月1日以前にSIMロック解除をキャリア店頭またはインターネットでされた「Android端末」は""], ""network_type"": [""商品の説明 購入前の注意事項 【注意事項】 注意事項①：電話番号は付与されませんので、ご注意ください。 注意事項②：SIMロックフリー端末、もしくはSIMフリー端末専用のサービスです。必ず、ご利用端末がeSIM対応かどうかご確認ください。 注意事項③：2021年10月1日以前にSIMロック解除をキャリア店頭またはインターネットでされた「Android端末」は"", ""【チョコSIM 定額（Sプラン）】【中国の電話番号付きでアプリや施設サービスのSMS認証が可能】【データ容量】合計500MB/月【音声】合計20分間/月 データ/音声/SMS付きSIMカード 中国SIM マカオSIM China unicom ※こちらのSIMカードは契約後、毎月の基本料が発生いたします。※2024年11月1日から台湾でのご利用はできなくなり"", ""score: local=9, roaming=1""], ""carrier_support_local"": [""Chunghwa Telecom: サービスプロバイダ Chunghwa Telecom"", ""Chunghwa Telecom: 【台湾eSIM】 5日間 高速データ無制限（低速なし）使い放題 実名登録不要 台湾SIMカード｜Chunghwa Telecom公式認証 台湾e-sim sim プリペイドSIM｜即日発行 LINE相談受付中｜TikTokとChatGPTとテザリング対応"", ""Chunghwa Telecom: 【台湾eSIM】 5日間 高速データ無制限（低速なし）使い放題 実名登録不要 台湾SIMカード｜Chunghwa Telecom公式認証 台湾e-sim sim プリペイドSIM｜即日発行 LINE相談受付中｜TikTokとChatGPTとテザリング対応"", ""Chunghwa Telecom: Amazon.co.jp: 【台湾eSIM】4日間 5GB（三泊四日 コスパ重視） DeSiM正規卸 | LINE相談受付中｜データ通信専用（電話番号なし） | simフリー端末のみ対応 説明書付 イーシム DeSiM : 家電＆カメラ 次に移動 メインコンテンツ この商品について この商品について""], ""review_count"": [""detail_page: (9)""], ""bestseller_rank"": [""Amazon 売れ筋ランキング 家電＆カメラ - 118,306位 ( 家電＆カメラの売れ筋ランキングを見る ) プリペイドSIMカード - 1,101位""], ""title"": [""【台湾eSIM】4日間 5GB（三泊四日 コスパ重視） DeSiM正規卸 | LINE相談受付中｜データ通信専用（電話番号なし） | simフリー端末のみ対応 説明書付 イーシム DeSiM""]}"
amazon_jp,tw,【台湾 SIM】5日間無制限データ | 日毎制限なし | 5G/4GLTE高速データ | 簡単アクティベーション | サポートLINEでのお問い合わせ,1550,3,,,,,937,5일,5일,180일,unknown,"{""chunghwa"": true, ""taiwan_mobile"": null, ""fareastone"": null}","{""skt"": null, ""kt"": null, ""lgu"": null}",unlimited,https://www.amazon.co.jp/SIM%E3%80%915%E6%97%A5%E9%96%93%E7%84%A1%E5%88%B6%E9%99%90%E3%83%87%E3%83%BC%E3%82%BF-%E6%97%A5%E6%AF%8E%E5%88%B6%E9%99%90%E3%81%AA%E3%81%97-4GLTE%E9%AB%98%E9%80%9F%E3%83%87%E3%83%BC%E3%82%BF-%E7%B0%A1%E5%8D%98%E3%82%A2%E3%82%AF%E3%83%86%E3%82%A3%E3%83%99%E3%83%BC%E3%82%B7%E3%83%A7%E3%83%B3-%E3%82%B5%E3%83%9D%E3%83%BC%E3%83%88LINE%E3%81%A7%E3%81%AE%E3%81%8A%E5%95%8F%E3%81%84%E5%90%88%E3%82%8F%E3%81%9B/dp/B0F247B2YQ,B0F247B2YQ,B0F247B2YQ,Happy Travel Sim Card,HAPPY TELECOMのストアを表示,"{""price_jpy"": [""￥1,550""], ""usage_validity"": [""【台湾 SIM】5日間無制限データ | 日毎制限なし | 5G/4GLTE高速データ | 簡単アクティベーション | サポートLINEでのお問い合わせ""], ""activation_validity"": [""データサービスを利用するためには、ローミングデータとローカルデータをオンにし、Wi-Fiはオフにしてください。また、フライトモードはオフにしてください。 有効期限：商品到着後180日。AppleのiOS、iPadOS、iPhone、iPad、およびAndroidデバイスをサポートしています。""], ""data_amount"": [""ほとんどの携帯電話に対応する3in1 SIMカードで、挿入するだけで使用可能です。登録は不要です。データ通信は無制限ですが、通話やメッセージは含まれていません。""], ""network_type"": [""local_signal: データサービスを利用するためには、ローミングデータとローカルデータをオンにし、Wi-Fiはオフにしてください。また、フライトモードはオフにしてください。 有効期限：商品到着後180日。AppleのiOS、iPadOS、iPhone、iPad、およびAndroidデバイスをサポートしています。"", ""roaming_signal: データサービスを利用するためには、ローミングデータとローカルデータをオンにし、Wi-Fiはオフにしてください。また、フライトモードはオフにしてください。 有効期限：商品到着後180日。AppleのiOS、iPadOS、iPhone、iPad、およびAndroidデバイスをサポートしています。"", ""insufficient_or_conflicting_signals(local=9, roaming=3)""], ""carrier_support_local"": [""Chunghwa Telecom: 【台湾eSIM】 5日間 高速データ無制限（低速なし）使い放題 実名登録不要 台湾SIMカード｜Chunghwa Telecom公式認証 台湾e-sim sim プリペイドSIM｜即日発行 LINE相談受付中｜TikTokとChatGPTとテザリング対応"", ""Chunghwa Telecom: 【台湾eSIM】 5日間 高速データ無制限（低速なし）使い放題 実名登録不要 台湾SIMカード｜Chunghwa Telecom公式認証 台湾e-sim sim プリペイドSIM｜即日発行 LINE相談受付中｜TikTokとChatGPTとテザリング対応"", ""Chunghwa Telecom: 【台湾eSIM】4日間完全無制限 高速データ通信（低速なし）5G/4G-LTE 使い放題 実名登録不要 中華電信正規台湾SIM eSIM プリペイドSIM esim taiwan sim ｜当日発行可能｜TikTok·ChatGPT·テザリング対応 ｜台北 高雄 桃園｜旅行・出張・留学""], ""review_count"": [""detail_page: (3)""], ""bestseller_rank"": [""Amazon 売れ筋ランキング 家電＆カメラ - 93,114位 ( 家電＆カメラの売れ筋ランキングを見る ) プリペイドSIMカード - 937位""], ""title"": [""【台湾 SIM】5日間無制限データ | 日毎制限なし | 5G/4GLTE高速データ | 簡単アクティベーション | サポートLINEでのお問い合わせ""]}"
amazon_jp,tw,【台湾 esim】台湾 simカード 中華電信 【15日間・10GB高速データ】 低速データ使い放題 当日発行可能 taiwan プリペイド SIMカード TAIWAN ESIM,1980,15,,,,,881,15일,15일,60일,local,"{""chunghwa"": true, ""taiwan_mobile"": null, ""fareastone"": null}","{""skt"": null, ""kt"": null, ""lgu"": null}",unlimited,https://www.amazon.co.jp/esim%E3%80%91%E5%8F%B0%E6%B9%BE-sim%E3%82%AB%E3%83%BC%E3%83%89-%E3%80%9015%E6%97%A5%E9%96%93%E3%83%BB10GB%E9%AB%98%E9%80%9F%E3%83%87%E3%83%BC%E3%82%BF%E3%80%91-%E4%BD%8E%E9%80%9F%E3%83%87%E3%83%BC%E3%82%BF%E4%BD%BF%E3%81%84%E6%94%BE%E9%A1%8C-%E5%BD%93%E6%97%A5%E7%99%BA%E8%A1%8C%E5%8F%AF%E8%83%BD/dp/B0CQ2PVRSK,B0CQ2PVRSK,B0CQ2PVRSK,Global Simcard,アーモンド　ＳＩｍ　ｃａｒｄのストアを表示,"{""price_jpy"": [""￥1,980""], ""usage_validity"": [""【台湾 esim】台湾 simカード 中華電信 【15日間・10GB高速データ】 低速データ使い放題 当日発行可能 taiwan プリペイド SIMカード TAIWAN ESIM""], ""activation_validity"": [""✿【有効期限】メールで納品した60日以内にご利用始めてください。""], ""data_amount"": [""✿【データ容量】データ専用のeSIMカードです。データ容量は無制限ですが、期間中定額GB数に達すると最大通信速度が128kbpsに制限されます。翌日の現地時間0時に速度制限が解除されます。※通信量は現地時間の00:00から23:59までの区切りでカウントされます。""], ""network_type"": [""【チョコSIM 定額（Sプラン）】【中国の電話番号付きでアプリや施設サービスのSMS認証が可能】【データ容量】合計500MB/月【音声】合計20分間/月 データ/音声/SMS付きSIMカード 中国SIM マカオSIM China unicom ※こちらのSIMカードは契約後、毎月の基本料が発生いたします。※2024年11月1日から台湾でのご利用はできなくなり"", ""【SKTelecoｍ公式認証】 韓国eSIM 3日間 (72時間) 電話番号付き 超高速データ無制限 最初の5分発信無料(韓国国内) お急ぎの方即時発行可(LINE相談受付中) 有効期限／ご購入日より120日以内 現地空港サポート(SKTelecomローミングセンター) SKテレコム正規品 韓国SIMカードタイプではありません"", ""score: local=6, roaming=0""], ""carrier_support_local"": [""Chunghwa Telecom: ✿【キャリア】中華電信。台湾では広範囲なカバレッジ、安定したネットワーク、高速な通信速度を提供しています。"", ""Chunghwa Telecom: Amazon.co.jp: 【台湾 esim】台湾 simカード 中華電信 【15日間・10GB高速データ】 低速データ使い放題 当日発行可能 taiwan プリペイド SIMカード TAIWAN ESIM : 家電＆カメラ"", ""Chunghwa Telecom: 【台湾 esim】台湾 simカード 中華電信 【15日間・10GB高速データ】 低速データ使い放題 当日発行可能 taiwan プリペイド SIMカード TAIWAN ESIM"", ""Chunghwa Telecom: 【台湾eSIM】4日間完全無制限 高速データ通信（低速なし）5G/4G-LTE 使い放題 実名登録不要 中華電信正規台湾SIM eSIM プリペイドSIM esim taiwan sim ｜当日発行可能｜TikTok·ChatGPT·テザリング対応 ｜台北 高雄 桃園｜旅行・出張・留学"", ""Chunghwa Telecom: 台湾esim 10日間・10GB 定額高速データ通信 低速データ使い放題 中華電信 当日発行可能 taiwan 台湾simカード プリペイド SIMカード TAIWAN ESIM (10日間・10GB定額高速データ)"", ""Chunghwa Telecom: 【台湾 esim】台湾 simカード 中華電信 【15日間・10GB高速データ】 低速データ使い放題 当日発行可能 taiwan プリペイド SIMカード TAIWAN ESIM"", ""Chunghwa Telecom: 【台湾eSIM】4日間完全無制限 高速データ通信（低速なし）5G/4G-LTE 使い放題 実名登録不要 中華電信正規台湾SIM eSIM プリペイドSIM esim taiwan sim ｜当日発行可能｜TikTok·ChatGPT·テザリング対応 ｜台北 高雄 桃園｜旅行・出張・留学"", ""Chunghwa Telecom: 【台湾 esim】台湾 simカード 中華電信 【15日間・10GB高速データ】 低速データ使い放題 当日発行可能 taiwan プリペイド SIMカード TAIWAN ESIM"", ""Chunghwa Telecom: Amazon.co.jp: 【台湾 esim】台湾 simカード 中華電信 【15日間・10GB高速データ】 低速データ使い放題 当日発行可能 taiwan プリペイド SIMカード TAIWAN ESIM : 家電＆カメラ 次に移動 メインコンテンツ この商品について この商品について この商品に""], ""review_count"": [""detail_page: (15)""], ""bestseller_rank"": [""Amazon 売れ筋ランキング 家電＆カメラ - 86,615位 ( 家電＆カメラの売れ筋ランキングを見る ) プリペイドSIMカード - 881位""], ""title"": [""【台湾 esim】台湾 simカード 中華電信 【15日間・10GB高速データ】 低速データ使い放題 当日発行可能 taiwan プリペイド SIMカード TAIWAN ESIM""]}"
amazon_jp,tw,【台湾 SIM】3日間無制限データ | 日毎制限なし | 5G/4GLTE高速データ | 簡単アクティベーション | サポートLINEでのお問い合わせ,998,8,,,,,1471,3일,3일,180일,unknown,"{""chunghwa"": true, ""taiwan_mobile"": null, ""fareastone"": null}","{""skt"": null, ""kt"": null, ""lgu"": null}",unlimited,https://www.amazon.co.jp/SIM%E3%80%913%E6%97%A5%E9%96%93%E7%84%A1%E5%88%B6%E9%99%90%E3%83%87%E3%83%BC%E3%82%BF-%E6%97%A5%E6%AF%8E%E5%88%B6%E9%99%90%E3%81%AA%E3%81%97-4GLTE%E9%AB%98%E9%80%9F%E3%83%87%E3%83%BC%E3%82%BF-%E7%B0%A1%E5%8D%98%E3%82%A2%E3%82%AF%E3%83%86%E3%82%A3%E3%83%99%E3%83%BC%E3%82%B7%E3%83%A7%E3%83%B3-%E3%82%B5%E3%83%9D%E3%83%BC%E3%83%88LINE%E3%81%A7%E3%81%AE%E3%81%8A%E5%95%8F%E3%81%84%E5%90%88%E3%82%8F%E3%81%9B/dp/B0F24C5Y4Z,B0F24C5Y4Z,B0F24C5Y4Z,Happy Travel Sim Card,HAPPY TELECOMのストアを表示,"{""price_jpy"": [""￥998""], ""usage_validity"": [""【台湾 SIM】3日間無制限データ | 日毎制限なし | 5G/4GLTE高速データ | 簡単アクティベーション | サポートLINEでのお問い合わせ""], ""activation_validity"": [""データサービスを利用するためには、ローミングデータとローカルデータをオンにし、Wi-Fiはオフにしてください。また、フライトモードはオフにしてください。 有効期限：商品到着後180日。 To use data services, please turn on roaming data and local data, and turn off Wi-Fi. A""], ""data_amount"": [""ほとんどの携帯電話に対応する3in1 SIMカードで、挿入するだけで使用可能です。登録は不要です。データ通信は無制限ですが、通話やメッセージは含まれていません。 This 3-in-1 SIM card is compatible with most mobile phones and can be used simply by inserting it. ""], ""network_type"": [""local_signal: データサービスを利用するためには、ローミングデータとローカルデータをオンにし、Wi-Fiはオフにしてください。また、フライトモードはオフにしてください。 有効期限：商品到着後180日。 To use data services, please turn on roaming data and local data, and turn off Wi-Fi. A"", ""roaming_signal: データサービスを利用するためには、ローミングデータとローカルデータをオンにし、Wi-Fiはオフにしてください。また、フライトモードはオフにしてください。 有効期限：商品到着後180日。 To use data services, please turn on roaming data and local data, and turn off Wi-Fi. A"", ""insufficient_or_conflicting_signals(local=7, roaming=3)""], ""carrier_support_local"": [""Chunghwa Telecom: 【台湾eSIM】4日間完全無制限 高速データ通信（低速なし）5G/4G-LTE 使い放題 実名登録不要 中華電信正規台湾SIM eSIM プリペイドSIM esim taiwan sim ｜当日発行可能｜TikTok·ChatGPT·テザリング対応 ｜台北 高雄 桃園｜旅行・出張・留学"", ""Chunghwa Telecom: 【台湾eSIM】4日間完全無制限 高速データ通信（低速なし）5G/4G-LTE 使い放題 実名登録不要 中華電信正規台湾SIM eSIM プリペイドSIM esim taiwan sim ｜当日発行可能｜TikTok·ChatGPT·テザリング対応 ｜台北 高雄 桃園｜旅行・出張・留学""], ""review_count"": [""detail_page: (8)""], ""bestseller_rank"": [""Amazon 売れ筋ランキング 家電＆カメラ - 169,444位 ( 家電＆カメラの売れ筋ランキングを見る ) プリペイドSIMカード - 1,471位""], ""title"": [""【台湾 SIM】3日間無制限データ | 日毎制限なし | 5G/4GLTE高速データ | 簡単アクティベーション | サポートLINEでのお問い合わせ""]}"
amazon_jp,tw,【中国・香港・マカオ・台湾 eSIM】90日間 20GB（３ヶ月コスパ重視） DeSiM正規卸 |LINE相談受付中 | 当日発行可能 |中国ネット規制対象外 中国でもGoogle、LINE、YouTubeなどVPNなしで利用可能 | データ通信専用（電話番号なし） simフリー端末のみ対応 説明書付 イーシム DeSiM,6356,238,,,,,170,7일,7일,90일,local,"{""chunghwa"": null, ""taiwan_mobile"": null, ""fareastone"": null}","{""skt"": null, ""kt"": null, ""lgu"": null}",unlimited,https://www.amazon.co.jp/%E3%80%90%E4%B8%AD%E5%9B%BD%E3%83%BB%E9%A6%99%E6%B8%AF%E3%83%BB%E3%83%9E%E3%82%AB%E3%82%AA%E3%83%BB%E5%8F%B0%E6%B9%BE-20GB%EF%BC%88%EF%BC%93%E3%83%B6%E6%9C%88%E3%82%B3%E3%82%B9%E3%83%91%E9%87%8D%E8%A6%96%EF%BC%89-%E4%B8%AD%E5%9B%BD%E3%81%A7%E3%82%82Google%E3%80%81LINE%E3%80%81YouTube%E3%81%AA%E3%81%A9VPN%E3%81%AA%E3%81%97%E3%81%A7%E5%88%A9%E7%94%A8%E5%8F%AF%E8%83%BD-%E3%83%87%E3%83%BC%E3%82%BF%E9%80%9A%E4%BF%A1%E5%B0%82%E7%94%A8%EF%BC%88%E9%9B%BB%E8%A9%B1%E7%95%AA%E5%8F%B7%E3%81%AA%E3%81%97%EF%BC%89-sim%E3%83%95%E3%83%AA%E3%83%BC%E7%AB%AF%E6%9C%AB%E3%81%AE%E3%81%BF%E5%AF%BE%E5%BF%9C/dp/B0D93FJ1HP,B0D93FJ1HP,B0D93FJ1HP,DeSiM,DeSiMのストアを表示,"{""price_jpy"": [""￥6,356""], ""usage_validity"": [""大中華区SIMカード-中国、香港、マカオ、台湾向けプリペイドデータプラン｜1 GB毎日データ、7日有効期限｜高速4/5 G LTE｜旅行者に最適""], ""activation_validity"": [""【中国・香港・マカオ・台湾 eSIM】90日間 20GB（３ヶ月コスパ重視） DeSiM正規卸 |LINE相談受付中 | 当日発行可能 |中国ネット規制対象外 中国でもGoogle、LINE、YouTubeなどVPNなしで利用可能 | データ通信専用（電話番号なし） simフリー端末のみ対応 説明書付 イーシム DeSiM""], ""data_amount"": [""商品の説明 購入前の注意事項 【注意事項】 注意事項①：電 話番号は付与されませんので、ご注意ください。 注意事項②：SIMロックフリー端末、もしくはSIMフリー端末専用のサービスです。必ず、ご利用端末がeSIM対応かどうかご確認ください。 注意事項③：2021年10月1日以前にSIMロック解除をキャリア店頭またはインターネットでされた「Android端末」""], ""network_type"": [""商品の説明 購入前の注意事項 【注意事項】 注意事項①：電 話番号は付与されませんので、ご注意ください。 注意事項②：SIMロックフリー端末、もしくはSIMフリー端末専用のサービスです。必ず、ご利用端末がeSIM対応かどうかご確認ください。 注意事項③：2021年10月1日以前にSIMロック解除をキャリア店頭またはインターネットでされた「Android端末」"", ""【チョコSIM 定額（Sプラン）】【中国の電話番号付きでアプリや施設サービスのSMS認証が可能】【データ容量】合計500MB/月【音声】合計20分間/月 データ/音声/SMS付きSIMカード 中国SIM マカオSIM China unicom ※こちらのSIMカードは契約後、毎月の基本料が発生いたします。※2024年11月1日から台湾でのご利用はできなくなり"", ""score: local=9, roaming=1""], ""review_count"": [""detail_page: (238)""], ""bestseller_rank"": [""Amazon 売れ筋ランキング 家電＆カメラ - 10,926位 ( 家電＆カメラの売れ筋ランキングを見る ) プリペイドSIMカード - 170位""], ""title"": [""【中国・香港・マカオ・台湾 eSIM】90日間 20GB（３ヶ月コスパ重視） DeSiM正規卸 |LINE相談受付中 | 当日発行可能 |中国ネット規制対象外 中国でもGoogle、LINE、YouTubeなどVPNなしで利用可能 | データ通信専用（電話番号なし） simフリー端末のみ対応 説明書付 イーシム DeSiM""]}"
