site,country,title,price_jpy,review_count,seller_badge,search_position,monthly_sold_count,is_bestseller,bestseller_rank,validity,usage_validity,activation_validity,network_type,carrier_support_local,carrier_support_kr,data_amount,product_url,asin,site_product_id,seller,brand,evidence
amazon_jp,tw,インド eSIM | 5日間3GB | 高速データ 5G/4G | QRコード 当日発行可 メール登録で即納品即利用可 | LINEサポート | データ通信専用(電話番号なし)| 日本で事前設定OK | テザリング可能 | パスポート情報不要・事前登録なし,1580,19,,,,,428,5일,5일,5일,unknown,"{""chunghwa"": null, ""taiwan_mobile"": null, ""fareastone"": null}","{""skt"": null, ""kt"": null, ""lgu"": null}",3GB,https://www.amazon.co.jp/%E3%83%A1%E3%83%BC%E3%83%AB%E7%99%BB%E9%8C%B2%E3%81%A7%E5%8D%B3%E7%B4%8D%E5%93%81%E5%8D%B3%E5%88%A9%E7%94%A8%E5%8F%AF-LINE%E3%82%B5%E3%83%9D%E3%83%BC%E3%83%88-%E3%83%87%E3%83%BC%E3%82%BF%E9%80%9A%E4%BF%A1%E5%B0%82%E7%94%A8-%E6%97%A5%E6%9C%AC%E3%81%A7%E4%BA%8B%E5%89%8D%E8%A8%AD%E5%AE%9AOK-%E3%83%91%E3%82%B9%E3%83%9D%E3%83%BC%E3%83%88%E6%83%85%E5%A0%B1%E4%B8%8D%E8%A6%81%E3%83%BB%E4%BA%8B%E5%89%8D%E7%99%BB%E9%8C%B2%E3%81%AA%E3%81%97/dp/B0F3PGHF21,B0F3PGHF21,B0F3PGHF21,TORA eSIM,TORAのストアを表示,"{""price_jpy"": [""￥1,580""], ""usage_validity"": [""インド eSIM | 5日間3GB | 高速データ 5G/4G | QRコード 当日発行可 メール登録で即納品即利用可 | LINEサポート | データ通信専用(電話番号なし)| 日本で事前設定OK | テザリング可能 | パスポート情報不要・事前登録なし""], ""activation_validity"": [""インドネシア旅行SIMカード - 5G/4G LTE高速データ - プリペイド＆ローミング禁止 - 5日間1GB - 観光客やビジネス旅行者のための簡単な有効化""], ""data_amount"": [""🐯データ通信🐯 5G/4G/LTE対応の高速データが【5日間3GB】使えます。※超過後は期間終了まで低速(128kbps)使い放題""], ""network_type"": [""local_signal: 🔺注意事項🔺 利用期限は台湾時間を基準とし、利用開始時間によらず、現地回線に接続した日から、購入プラン日数の23:59(台湾時間)までとなります。※台湾時間の0時は、日本時間の深夜1時"", ""roaming_signal: 商品の説明 ご利用前に必ずご確認ください！ この商品はeSIMです、物理SIMではありません。eSIM非対応の端末ではご利用できません。 以下の手順でお使いの端末が「eSIM対応端末」と「SIMロックされていない」をご確認ください。 ① eSIM対応端末の確認方法 スマホのダイヤル発信画面で「*#06#」をダイヤルし、デバイス情報に「EID」表示されればご利"", ""insufficient_or_conflicting_signals(local=6, roaming=10)""], ""review_count"": [""detail_page: (19)""], ""bestseller_rank"": [""Amazon 売れ筋ランキング 家電＆カメラ - 32,318位 ( 家電＆カメラの売れ筋ランキングを見る ) プリペイドSIMカード - 428位""], ""title"": [""インド eSIM | 5日間3GB | 高速データ 5G/4G | QRコード 当日発行可 メール登録で即納品即利用可 | LINEサポート | データ通信専用(電話番号なし)| 日本で事前設定OK | テザリング可能 | パスポート情報不要・事前登録なし""]}"
amazon_jp,tw,ヨーロッパ48ヵ国SIM 利用期間30日データ容量6GB ヨーロッパプリペイドSIM ローミングSIM 利用国：イタリア・フランス・イギリス・ドイツ・スペイン・フィンランド等,1480,366,,,,,267,1일,1일,30일,unknown,"{""chunghwa"": null, ""taiwan_mobile"": null, ""fareastone"": null}","{""skt"": null, ""kt"": null, ""lgu"": null}",6GB,https://www.amazon.co.jp/%E3%83%A8%E3%83%BC%E3%83%AD%E3%83%83%E3%83%9148%E3%83%B5%E5%9B%BDSIM-%E5%88%A9%E7%94%A8%E6%9C%9F%E9%96%9330%E6%97%A5%E3%83%87%E3%83%BC%E3%82%BF%E5%AE%B9%E9%87%8F6GB-%E3%83%A8%E3%83%BC%E3%83%AD%E3%83%83%E3%83%91%E3%83%97%E3%83%AA%E3%83%9A%E3%82%A4%E3%83%89SIM-%E3%83%AD%E3%83%BC%E3%83%9F%E3%83%B3%E3%82%B0SIM-%E5%88%A9%E7%94%A8%E5%9B%BD%EF%BC%9A%E3%82%A4%E3%82%BF%E3%83%AA%E3%82%A2%E3%83%BB%E3%83%95%E3%83%A9%E3%83%B3%E3%82%B9%E3%83%BB%E3%82%A4%E3%82%AE%E3%83%AA%E3%82%B9%E3%83%BB%E3%83%89%E3%82%A4%E3%83%84%E3%83%BB%E3%82%B9%E3%83%9A%E3%82%A4%E3%83%B3%E3%83%BB%E3%83%95%E3%82%A3%E3%83%B3%E3%83%A9%E3%83%B3%E3%83%89%E7%AD%89/dp/B0G6L1ZZ9X,B0G6L1ZZ9X,B0G6L1ZZ9X,ブランド: Wise SIM,ブランド: Wise SIM,"{""price_jpy"": [""価格 ￥1,480 ￥1,950 ￥1,980 ￥2,380 ￥2,250""], ""usage_validity"": [""【利用期間】 台湾の通信会社が発行しているSIMの為、台湾時間を基準として電波を受信後30日(日数カウント) 例えば台湾の23時に利用開始した場合、1時間で1日分としてカウントされますのでご留意ください。 ※延長・チャージは出来ません。""], ""activation_validity"": [""ヨーロッパ48ヵ国SIM 利用期間30日データ容量6GB ヨーロッパプリペイドSIM ローミングSIM 利用国：イタリア・フランス・イギリス・ドイツ・スペイン・フィンランド等""], ""data_amount"": [""【データ容量】 高速データ通信が6GBまで利用可能です。 ※6GB超過後は128kbpsへ速度低下となりますが、通信は止まる事無くご利用可能です。""], ""network_type"": [""local_signal: 【SKTelecoｍ公式認証】 韓国eSIM 3日間 (72時間) 電話番号付き 超高速データ無制限 最初の5分発信無料(韓国国内) お急ぎの方即時発行可(LINE相談受付中) 有効期限／ご購入日より120日以内 現地空港サポート(SKTelecomローミングセンター) SKテレコム正規品 韓国SIMカードタイプではありません"", ""roaming_signal: ヨーロッパ48ヵ国SIM 利用期間30日データ容量6GB ヨーロッパプリペイドSIM ローミングSIM 利用国：イタリア・フランス・イギリス・ドイツ・スペイン・フィンランド等"", ""insufficient_or_conflicting_signals(local=3, roaming=6)""], ""review_count"": [""detail_page: (366)""], ""bestseller_rank"": [""Amazon 売れ筋ランキング 家電＆カメラ - 19,142位 ( 家電＆カメラの売れ筋ランキングを見る ) プリペイドSIMカード - 267位""], ""title"": [""ヨーロッパ48ヵ国SIM 利用期間30日データ容量6GB ヨーロッパプリペイドSIM ローミングSIM 利用国：イタリア・フランス・イギリス・ドイツ・スペイン・フィンランド等""]}"
amazon_jp,tw,香港 eSIM | 4日間 | 高速データ無制限使い放題 5G/4G | QRコード 当日発行可 メール登録で即納品即利用可 | LINEサポート | データ通信専用(電話番号なし)| 日本で事前設定OK | テザリング可能 | パスポート情報不要・実名登録なし,1250,4,,,,,494,3일,3일,4일,unknown,"{""chunghwa"": null, ""taiwan_mobile"": null, ""fareastone"": null}","{""skt"": null, ""kt"": null, ""lgu"": null}",unlimited,https://www.amazon.co.jp/4%E6%97%A5%E9%96%93-%E9%AB%98%E9%80%9F%E3%83%87%E3%83%BC%E3%82%BF%E7%84%A1%E5%88%B6%E9%99%90%E4%BD%BF%E3%81%84%E6%94%BE%E9%A1%8C-%E3%83%A1%E3%83%BC%E3%83%AB%E7%99%BB%E9%8C%B2%E3%81%A7%E5%8D%B3%E7%B4%8D%E5%93%81%E5%8D%B3%E5%88%A9%E7%94%A8%E5%8F%AF-%E6%97%A5%E6%9C%AC%E3%81%A7%E4%BA%8B%E5%89%8D%E8%A8%AD%E5%AE%9AOK-%E3%83%91%E3%82%B9%E3%83%9D%E3%83%BC%E3%83%88%E6%83%85%E5%A0%B1%E4%B8%8D%E8%A6%81%E3%83%BB%E5%AE%9F%E5%90%8D%E7%99%BB%E9%8C%B2%E3%81%AA%E3%81%97/dp/B0F3JXJ58N,B0F3JXJ58N,B0F3JXJ58N,TORA eSIM,TORAのストアを表示,"{""price_jpy"": [""￥1,250""], ""usage_validity"": [""【SKTelecoｍ公式認証】 韓国eSIM 3日間 (72時間) 電話番号付き 超高速データ無制限 最初の5分発信無料(韓国国内) お急ぎの方即時発行可(LINE相談受付中) 有効期限／ご購入日より120日以内 現地空港サポート(SKTelecomローミングセンター) SKテレコム正規品 韓国SIMカードタイプではありません""], ""activation_validity"": [""香港 eSIM | 4日間 | 高速データ無制限使い放題 5G/4G | QRコード 当日発行可 メール登録で即納品即利用可 | LINEサポート | データ通信専用(電話番号なし)| 日本で事前設定OK | テザリング可能 | パスポート情報不要・実名登録なし""], ""data_amount"": [""🐯データ通信🐯 5G/4G/LTE対応の高速データが【無制限】使えます。""], ""network_type"": [""local_signal: 🔺注意事項🔺 利用期限は台湾時間を基準とし、利用開始時間によらず、現地回線に接続した日から、購入プラン日数の23:59(台湾時間)までの暦日制となります。※台湾時間の0時は、日本時間の深夜1時"", ""roaming_signal: 商品の説明 ご利用前に必ずご確認ください！ この商品はeSIMです、物理SIMではありません。eSIM非対応の端末ではご利用できません。 以下の手順でお使いの端末が「eSIM対応端末」と「SIMロックされていない」をご確認ください。 ① eSIM対応端末の確認方法 スマホのダイヤル発信画面で「*#06#」をダイヤルし、デバイス情報に「EID」表示されればご利"", ""insufficient_or_conflicting_signals(local=9, roaming=3)""], ""review_count"": [""detail_page: (4)""], ""bestseller_rank"": [""Amazon 売れ筋ランキング 家電＆カメラ - 39,354位 ( 家電＆カメラの売れ筋ランキングを見る ) プリペイドSIMカード - 494位""], ""title"": [""香港 eSIM | 4日間 | 高速データ無制限使い放題 5G/4G | QRコード 当日発行可 メール登録で即納品即利用可 | LINEサポート | データ通信専用(電話番号なし)| 日本で事前設定OK | テザリング可能 | パスポート情報不要・実名登録なし""]}"
amazon_jp,tw,台湾限定 台湾風情シリーズ 感謝のことば 悠遊カード ゆうゆうカード 台湾交通系ICカード TAIWAN 日本未発売 [並行輸入品],1580,29,,,,,11161,3일,3일,5일,unknown,"{""chunghwa"": true, ""taiwan_mobile"": null, ""fareastone"": null}","{""skt"": null, ""kt"": null, ""lgu"": null}",unlimited,https://www.amazon.co.jp/%E5%8F%B0%E6%B9%BE%E9%A2%A8%E6%83%85%E3%82%B7%E3%83%AA%E3%83%BC%E3%82%BA-%E6%84%9F%E8%AC%9D%E3%81%AE%E3%81%93%E3%81%A8%E3%81%B0-%E3%82%86%E3%81%86%E3%82%86%E3%81%86%E3%82%AB%E3%83%BC%E3%83%89-%E5%8F%B0%E6%B9%BE%E4%BA%A4%E9%80%9A%E7%B3%BBIC%E3%82%AB%E3%83%BC%E3%83%89-TAIWAN/dp/B0D9Y5J985,B0D9Y5J985,B0D9Y5J985,ロブスタークラブ-online,ブランド: ノーブランド品,"{""price_jpy"": [""￥1,580""], ""usage_validity"": [""【SKTelecoｍ公式認証】 韓国eSIM 3日間 (72時間) 電話番号付き 超高速データ無制限 最初の5分発信無料(韓国国内) お急ぎの方即時発行可(LINE相談受付中) 有効期限／ご購入日より120日以内 現地空港サポート(SKTelecomローミングセンター) SKテレコム正規品 韓国SIMカードタイプではありません""], ""activation_validity"": [""台湾4G/5G LTE プリペイドSIMカード - 1GB高速データ、旅行用5日間無制限ローミング (即時アクティベーション)""], ""data_amount"": [""【台湾 eSIM】5日間無制限高速データ｜ 5G/4G対応｜QRコード簡単設定｜即日メール送信｜日本語ガイド付き｜LINEでサポート｜テザリング対応｜台北・高雄・桃園対応｜旅行・出張・留学向けTaiwan 台湾 sim(5日間無制限)""], ""network_type"": [""local_signal: 【チョコSIM 定額（Sプラン）】【中国の電話番号付きでアプリや施設サービスのSMS認証が可能】【データ容量】合計500MB/月【音声】合計20分間/月 データ/音声/SMS付きSIMカード 中国SIM マカオSIM China unicom ※こちらのSIMカードは契約後、毎月の基本料が発生いたします。※2024年11月1日から台湾でのご利用はできなくなり"", ""roaming_signal: 台湾4G/5G LTE プリペイドSIMカード - 1GB高速データ、旅行用5日間無制限ローミング (即時アクティベーション)"", ""insufficient_or_conflicting_signals(local=6, roaming=5)""], ""carrier_support_local"": [""Chunghwa Telecom: 【台湾 SIM】大容量プラン 2GB/日・高速データ通信 データ使い放題 中華電信キャリア データ通信専用 台湾 simカード 台北 台湾 sim LINEで24時間サポート (20日間)"", ""Chunghwa Telecom: 台湾esim 3日間・3GB 定額高速データ通信 低速データ使い放題 中華電信 当日発行可能 taiwan 台湾simカード プリペイド SIMカード TAIWAN ESIM (3日間・3GB定額高速データ)"", ""Chunghwa Telecom: Amazon.co.jp: 台湾限定 台湾風情シリーズ 感謝のことば 悠遊カード ゆうゆうカード 台湾交通系ICカード TAIWAN 日本未発売 [並行輸入品] : ホビー 次に移動 メインコンテンツ この商品について この商品について この商品について 購入オプション 類似商品と比較する ビデオ ""], ""review_count"": [""detail_page: 29""], ""bestseller_rank"": [""Amazon 売れ筋ランキング ホビー - 156,102位 ( ホビーの売れ筋ランキングを見る ) アニメ・萌えグッズ - 11,161位""], ""title"": [""台湾限定 台湾風情シリーズ 感謝のことば 悠遊カード ゆうゆうカード 台湾交通系ICカード TAIWAN 日本未発売 [並行輸入品]""]}"
amazon_jp,tw,【マレーシアeSIM】5日間完全無制限（使い放題） LINE相談受付中｜データ通信専用（電話番号なし） | simフリー端末のみ対応 説明書付 イーシム simless,1140,10,,,,,1975,3일,3일,5일,local,"{""chunghwa"": null, ""taiwan_mobile"": null, ""fareastone"": null}","{""skt"": null, ""kt"": null, ""lgu"": null}",unlimited,https://www.amazon.co.jp/%E3%80%90%E3%83%9E%E3%83%AC%E3%83%BC%E3%82%B7%E3%82%A2eSIM%E3%80%915%E6%97%A5%E9%96%93%E5%AE%8C%E5%85%A8%E7%84%A1%E5%88%B6%E9%99%90%EF%BC%88%E4%BD%BF%E3%81%84%E6%94%BE%E9%A1%8C%EF%BC%89-LINE%E7%9B%B8%E8%AB%87%E5%8F%97%E4%BB%98%E4%B8%AD%EF%BD%9C%E3%83%87%E3%83%BC%E3%82%BF%E9%80%9A%E4%BF%A1%E5%B0%82%E7%94%A8%EF%BC%88%E9%9B%BB%E8%A9%B1%E7%95%AA%E5%8F%B7%E3%81%AA%E3%81%97%EF%BC%89-sim%E3%83%95%E3%83%AA%E3%83%BC%E7%AB%AF%E6%9C%AB%E3%81%AE%E3%81%BF%E5%AF%BE%E5%BF%9C-%E8%AA%AC%E6%98%8E%E6%9B%B8%E4%BB%98-simless/dp/B0DXLG4VT3,B0DXLG4VT3,B0DXLG4VT3,DeSiM,DeSiMのストアを表示,"{""price_jpy"": [""￥1,140""], ""usage_validity"": [""【SKTelecoｍ公式認証】 韓国eSIM 3日間 (72時間) 電話番号付き 超高速データ無制限 最初の5分発信無料(韓国国内) お急ぎの方即時発行可(LINE相談受付中) 有効期限／ご購入日より120日以内 現地空港サポート(SKTelecomローミングセンター) SKテレコム正規品 韓国SIMカードタイプではありません""], ""activation_validity"": [""【マレーシアeSIM】5日間完全無制限（使い放題） LINE相談受付中｜データ通信専用（電話番号なし） | simフリー端末のみ対応 説明書付 イーシム simless""], ""data_amount"": [""商品の説明 購入前の注意事項 【注意事項】 注意事項①：電話番号は付与されませんので、ご注意ください。 注意事項②：SIMロックフリー端末、もしくはSIMフリー端末専用のサービスです。必ず、ご利用端末がeSIM対応かどうかご確認ください。 注意事項③：2021年10月1日以前にSIMロック解除をキャリア店頭またはインターネットでされた「Android端末」は""], ""network_type"": [""商品の説明 購入前の注意事項 【注意事項】 注意事項①：電話番号は付与されませんので、ご注意ください。 注意事項②：SIMロックフリー端末、もしくはSIMフリー端末専用のサービスです。必ず、ご利用端末がeSIM対応かどうかご確認ください。 注意事項③：2021年10月1日以前にSIMロック解除をキャリア店頭またはインターネットでされた「Android端末」は"", ""【チョコSIM 定額（Sプラン）】【中国の電話番号付きでアプリや施設サービスのSMS認証が可能】【データ容量】合計500MB/月【音声】合計20分間/月 データ/音声/SMS付きSIMカード 中国SIM マカオSIM China unicom ※こちらのSIMカードは契約後、毎月の基本料が発生いたします。※2024年11月1日から台湾でのご利用はできなくなり"", ""score: local=9, roaming=1""], ""review_count"": [""detail_page: 10""], ""bestseller_rank"": [""Amazon 売れ筋ランキング 家電＆カメラ - 247,570位 ( 家電＆カメラの売れ筋ランキングを見る ) プリペイドSIMカード - 1,975位""], ""title"": [""【マレーシアeSIM】5日間完全無制限（使い放題） LINE相談受付中｜データ通信専用（電話番号なし） | simフリー端末のみ対応 説明書付 イーシム simless""]}"
amazon_jp,tw,【フィリピンeSIM】5日間完全無制限（使い放題） LINE相談受付中｜データ通信専用（電話番号なし） | simフリー端末のみ対応 説明書付 イーシム simless,1620,6,,,,,214,3일,3일,5일,local,"{""chunghwa"": null, ""taiwan_mobile"": null, ""fareastone"": null}","{""skt"": null, ""kt"": null, ""lgu"": null}",unlimited,https://www.amazon.co.jp/%E3%80%90%E3%83%95%E3%82%A3%E3%83%AA%E3%83%94%E3%83%B3eSIM%E3%80%915%E6%97%A5%E9%96%93%E5%AE%8C%E5%85%A8%E7%84%A1%E5%88%B6%E9%99%90%EF%BC%88%E4%BD%BF%E3%81%84%E6%94%BE%E9%A1%8C%EF%BC%89-LINE%E7%9B%B8%E8%AB%87%E5%8F%97%E4%BB%98%E4%B8%AD%EF%BD%9C%E3%83%87%E3%83%BC%E3%82%BF%E9%80%9A%E4%BF%A1%E5%B0%82%E7%94%A8%EF%BC%88%E9%9B%BB%E8%A9%B1%E7%95%AA%E5%8F%B7%E3%81%AA%E3%81%97%EF%BC%89-sim%E3%83%95%E3%83%AA%E3%83%BC%E7%AB%AF%E6%9C%AB%E3%81%AE%E3%81%BF%E5%AF%BE%E5%BF%9C-%E8%AA%AC%E6%98%8E%E6%9B%B8%E4%BB%98-simless/dp/B0DZ6FTDGY,B0DZ6FTDGY,B0DZ6FTDGY,DeSiM,DeSiMのストアを表示,"{""price_jpy"": [""￥1,620""], ""usage_validity"": [""【SKTelecoｍ公式認証】 韓国eSIM 3日間 (72時間) 電話番号付き 超高速データ無制限 最初の5分発信無料(韓国国内) お急ぎの方即時発行可(LINE相談受付中) 有効期限／ご購入日より120日以内 現地空港サポート(SKTelecomローミングセンター) SKテレコム正規品 韓国SIMカードタイプではありません""], ""activation_validity"": [""【フィリピンeSIM】5日間完全無制限（使い放題） LINE相談受付中｜データ通信専用（電話番号なし） | simフリー端末のみ対応 説明書付 イーシム simless""], ""data_amount"": [""【フィリピンeSIM】5日間完全無制限（使い放題） LINE相談受付中｜データ通信専用（電話番号なし） | simフリー端末のみ対応 説明書付 イーシム simless""], ""network_type"": [""【チョコSIM 定額（Sプラン）】【中国の電話番号付きでアプリや施設サービスのSMS認証が可能】【データ容量】合計500MB/月【音声】合計20分間/月 データ/音声/SMS付きSIMカード 中国SIM マカオSIM China unicom ※こちらのSIMカードは契約後、毎月の基本料が発生いたします。※2024年11月1日から台湾でのご利用はできなくなり"", ""【SKTelecoｍ公式認証】 韓国eSIM 3日間 (72時間) 電話番号付き 超高速データ無制限 最初の5分発信無料(韓国国内) お急ぎの方即時発行可(LINE相談受付中) 有効期限／ご購入日より120日以内 現地空港サポート(SKTelecomローミングセンター) SKテレコム正規品 韓国SIMカードタイプではありません"", ""score: local=6, roaming=1""], ""review_count"": [""detail_page: (6)""], ""bestseller_rank"": [""Amazon 売れ筋ランキング 家電＆カメラ - 13,643位 ( 家電＆カメラの売れ筋ランキングを見る ) プリペイドSIMカード - 214位""], ""title"": [""【フィリピンeSIM】5日間完全無制限（使い放題） LINE相談受付中｜データ通信専用（電話番号なし） | simフリー端末のみ対応 説明書付 イーシム simless""]}"
amazon_jp,tw,【アジア35カ国 eSIM】9日間 低速データ通信無制限 高速データ通信6GB 実名登録不要 QR簡単設定 メール登録で納品 アジアSIM 即日発行対応 急ぎの方LINEサポートあり 韓国sim 日本sim 台湾simベトナムsim 中国sim マグロeSIM,2880,2,,,,,1457,9일,9일,60일,roaming,"{""chunghwa"": null, ""taiwan_mobile"": null, ""fareastone"": null}","{""skt"": null, ""kt"": null, ""lgu"": null}",unlimited,https://www.amazon.co.jp/%E3%80%90%E3%82%A2%E3%82%B8%E3%82%A235%E3%82%AB%E5%9B%BD-%E4%BD%8E%E9%80%9F%E3%83%87%E3%83%BC%E3%82%BF%E9%80%9A%E4%BF%A1%E7%84%A1%E5%88%B6%E9%99%90-%E9%AB%98%E9%80%9F%E3%83%87%E3%83%BC%E3%82%BF%E9%80%9A%E4%BF%A16GB-%E6%80%A5%E3%81%8E%E3%81%AE%E6%96%B9LINE%E3%82%B5%E3%83%9D%E3%83%BC%E3%83%88%E3%81%82%E3%82%8A-%E3%83%9E%E3%82%B0%E3%83%ADeSIM/dp/B0DXJQVW9K,B0DXJQVW9K,B0DXJQVW9K,マグロeSIM,ブランド: マグロeSIM,"{""price_jpy"": [""￥2,880""], ""usage_validity"": [""【アジア35カ国 eSIM】9日間 低速データ通信無制限 高速データ通信6GB 実名登録不要 QR簡単設定 メール登録で納品 アジアSIM 即日発行対応 急ぎの方LINEサポートあり 韓国sim 日本sim 台湾simベトナムsim 中国sim マグロeSIM""], ""activation_validity"": [""【注意事項①】有効期限：eSIM QRコードを受け取ってから60日間です（有効期間内にご利用ください）。eSIMの使用期間は、現地の回線に接続した時点からプランの最終日の23時59分までです。""], ""data_amount"": [""【データ容量】データ容量は無制限ですが、9日以内にデータ通信量が6GBを超えると、通信速度が128Kbpsに制限され、翌日の現地時間0時に自動的にスピード制限が解除されます。※地点によっては信号が届かない場合がありますのでご了承ください。""], ""network_type"": [""商品の説明 購入前にご注意！ 注意事項①：ご購入後、商品画像に記載されたURLにアクセスし必要事項を入力→メールアドレスにPDFの説明書とeSIMのQRコードが届きます！ 注意事項②：SIMロックフリー端末、もしくはSIMフリー端末専用のサービスです。必ず、ご利用端末がeSIM対応かどうかご確認ください。 注意事項③：eSIM対応端末のみ利用可能。※通信キャ"", ""ViraDenki プリペイドSIMカード [楽天回線、au回線、国際ローミング対応] 国内海外 プリペイドSIM - 1年間有効 3GBデータ通信用SIMカード（SMS認証可）5G/4G-LTE対応 【月容量3GB/1年間】"", ""score: local=0, roaming=10""], ""review_count"": [""detail_page: (2)""], ""bestseller_rank"": [""Amazon 売れ筋ランキング 家電＆カメラ - 166,876位 ( 家電＆カメラの売れ筋ランキングを見る ) プリペイドSIMカード - 1,457位""], ""title"": [""【アジア35カ国 eSIM】9日間 低速データ通信無制限 高速データ通信6GB 実名登録不要 QR簡単設定 メール登録で納品 アジアSIM 即日発行対応 急ぎの方LINEサポートあり 韓国sim 日本sim 台湾simベトナムsim 中国sim マグロeSIM""]}"
