site,country,title,price_jpy,review_count,seller_badge,search_position,monthly_sold_count,is_bestseller,bestseller_rank,validity,usage_validity,activation_validity,network_type,carrier_support_local,carrier_support_kr,data_amount,product_url,asin,site_product_id,seller,brand,evidence
amazon_jp,tw,【台湾eSIM】4日間完全無制限（低速なし） LINE相談受付中｜データ通信専用（電話番号なし） | simフリー端末のみ対応 説明書付 イーシム simless,1050,297,,,400,,6,4일,4일,30일,local,"{""chunghwa"": true, ""taiwan_mobile"": null, ""fareastone"": null}","{""skt"": null, ""kt"": null, ""lgu"": null}",unlimited,https://www.amazon.co.jp/%E3%80%90%E5%8F%B0%E6%B9%BEeSIM%E3%80%914%E6%97%A5%E9%96%93%E5%AE%8C%E5%85%A8%E7%84%A1%E5%88%B6%E9%99%90%EF%BC%88%E4%BD%8E%E9%80%9F%E3%81%AA%E3%81%97%EF%BC%89-LINE%E7%9B%B8%E8%AB%87%E5%8F%97%E4%BB%98%E4%B8%AD%EF%BD%9C%E3%83%87%E3%83%BC%E3%82%BF%E9%80%9A%E4%BF%A1%E5%B0%82%E7%94%A8%EF%BC%88%E9%9B%BB%E8%A9%B1%E7%95%AA%E5%8F%B7%E3%81%AA%E3%81%97%EF%BC%89-sim%E3%83%95%E3%83%AA%E3%83%BC%E7%AB%AF%E6%9C%AB%E3%81%AE%E3%81%BF%E5%AF%BE%E5%BF%9C-%E8%AA%AC%E6%98%8E%E6%9B%B8%E4%BB%98-simless/dp/B0DS1XZGT3,B0DS1XZGT3,B0DS1XZGT3,DeSiM,DeSiMのストアを表示,"{""price_jpy"": [""￥1,050""], ""usage_validity"": [""【台湾eSIM】4日間完全無制限（低速なし） LINE相談受付中｜データ通信専用（電話番号なし） | simフリー端末のみ対応 説明書付 イーシム simless""], ""activation_validity"": [""【World eSIM】 台湾 esim 3日間 高速データ通信 無制限 データ通信専用 台湾 sim 中華電信 正規品 （有効期限 : 購入日から30日）""], ""data_amount"": [""商品の説明 購入前の注意事項 【注意事項】 注意事項①：電話番号は付与されませんので、ご注意ください。 注意事項②：SIMロックフリー端末、もしくはSIMフリー端末専用のサービスです。必ず、ご利用端末がeSIM対応かどうかご確認ください。 注意事項③：2021年10月1日以前にSIMロック解除をキャリア店頭またはインターネットでされた「Android端末」は""], ""network_type"": [""商品の説明 購入前の注意事項 【注意事項】 注意事項①：電話番号は付与されませんので、ご注意ください。 注意事項②：SIMロックフリー端末、もしくはSIMフリー端末専用のサービスです。必ず、ご利用端末がeSIM対応かどうかご確認ください。 注意事項③：2021年10月1日以前にSIMロック解除をキャリア店頭またはインターネットでされた「Android端末」は"", ""【SKTelecoｍ公式認証】 韓国eSIM 3日間 (72時間) 電話番号付き 超高速データ無制限 最初の5分発信無料(韓国国内) お急ぎの方即時発行可(LINE相談受付中) 有効期限／ご購入日より120日以内 現地空港サポート(SKTelecomローミングセンター) SKテレコム正規品 韓国SIMカードタイプではありません"", ""score: local=6, roaming=1""], ""carrier_support_local"": [""Chunghwa Telecom: 【台湾eSIM】4日間完全無制限 高速データ通信（低速なし）5G/4G-LTE 使い放題 実名登録不要 中華電信正規台湾SIM eSIM プリペイドSIM esim taiwan sim ｜当日発行可能｜TikTok·ChatGPT·テザリング対応 ｜台北 高雄 桃園｜旅行・出張・留学"", ""Chunghwa Telecom: 【台湾eSIM】 5日間 高速データ無制限（低速なし）使い放題 実名登録不要 台湾SIMカード｜Chunghwa Telecom公式認証 台湾e-sim sim プリペイドSIM｜即日発行 LINE相談受付中｜TikTokとChatGPTとテザリング対応"", ""Chunghwa Telecom: 【台湾eSIM】4日間完全無制限 高速データ通信（低速なし）5G/4G-LTE 使い放題 実名登録不要 中華電信正規台湾SIM eSIM プリペイドSIM esim taiwan sim ｜当日発行可能｜TikTok·ChatGPT·テザリング対応"", ""Chunghwa Telecom: 【World eSIM】 台湾 esim 3日間 高速データ通信 無制限 データ通信専用 台湾 sim 中華電信 正規品 （有効期限 : 購入日から30日）"", ""Chunghwa Telecom: 【台湾eSIM】 4日間 高速データ無制限（低速なし）使い放題 実名登録不要 台湾SIMカード｜Chunghwa Telecom公式認証 台湾e-sim sim プリペイドSIM｜即日発行 LINE相談受付中｜TikTokとChatGPTとテザリング対応"", ""Chunghwa Telecom: 【台湾eSIM】4日間完全無制限 高速データ通信（低速なし）5G/4G-LTE 使い放題 実名登録不要 中華電信正規台湾SIM eSIM プリペイドSIM esim taiwan sim ｜当日発行可能｜TikTok·ChatGPT·テザリング対応 ｜台北 高雄 桃園｜旅行・出張・留学""], ""monthly_sold_count"": [""Amazon.co.jp: 【台湾eSIM】4日間完全無制限（低速なし） LINE相談受付中｜データ通信専用（電話番号なし） | simフリー端末のみ対応 説明書付 イーシム simless : 家電＆カメラ 次に移動 メインコンテンツ この商品について この商品について この商品について 購入オプション 類似商品と比較する ビデオ レビュー キーボードショ""], ""review_count"": [""detail_page: (297)""], ""bestseller_rank"": [""Amazon 売れ筋ランキング 家電＆カメラ - 726位 ( 家電＆カメラの売れ筋ランキングを見る ) プリペイドSIMカード - 6位""], ""title"": [""【台湾eSIM】4日間完全無制限（低速なし） LINE相談受付中｜データ通信専用（電話番号なし） | simフリー端末のみ対応 説明書付 イーシム simless""]}"
amazon_jp,tw,台湾 TAIWAN ESIMプラン 4日間 完全無制限 4G-LTE 高速データ 使い放題 当日発行可能 出発前日本テスト用eSIM500MB 台北 高雄 プリペイドSIM 桃園 esim taiwan sim (4日間完全無制限),1680,415,,,200,,32,4일,4일,30일,unknown,"{""chunghwa"": true, ""taiwan_mobile"": null, ""fareastone"": null}","{""skt"": null, ""kt"": null, ""lgu"": null}",unlimited,https://www.amazon.co.jp/TAIWAN-ESIM%E3%83%97%E3%83%A9%E3%83%B3-4G-LTE-%E3%83%97%E3%83%AA%E3%83%9A%E3%82%A4%E3%83%89SIM-4%E6%97%A5%E9%96%93%E5%AE%8C%E5%85%A8%E7%84%A1%E5%88%B6%E9%99%90/dp/B0CY1JXCZ7,B0CY1JXCZ7,B0CY1JXCZ7,株式会社ビッグコネクト,bigconnectのストアを表示,"{""price_jpy"": [""￥1,680""], ""usage_validity"": [""台湾 TAIWAN ESIMプラン 4日間 完全無制限 4G-LTE 高速データ 使い放題 当日発行可能 出発前日本テスト用eSIM500MB 台北 高雄 プリペイドSIM 桃園 esim taiwan sim (4日間完全無制限)""], ""activation_validity"": [""【SimCardの有効期限】メールで納品した30日以内にご利用始めてください。該当の商品はEsimcardになります、物理SIMカードを装着するのではなく、スマートフォンやタブレット等の端末内にあらかじめ埋め込まれたチップに、インターネット経由でデータプランを書き込むことができます。物理のSIMが入っていません。""], ""data_amount"": [""【高速データ完全無制限】 通信専用Esimになります。※データ容量無制限。高速データ使い放題※現地時間の00:00-23：59区切りで、カウントされます。""], ""network_type"": [""local_signal: 【現地キャリア利用】台湾で使用できるeSIM、TAIWAN渡航スケジュールに対応する手軽なeSIMカード。キャリア：中華電信 、台湾では信号が広く、ネットワークが安定し、速度が速いです。eSIMのsimカードはプリペイドsimカードと違って、挿入作業不要(iPhone・androidともeSIMのQRコードを読み取って設定後すぐに使えます。）"", ""roaming_signal: 【DeSiM】日本 eSIM 180日間 10GB 格安ローミング回線 日本国内チャージ可＋海外32カ国チャージ対応（韓国/台湾/香港/中国/米国 等） 高速通信 テザリング対応 QR即時発行 日本語サポート V3"", ""insufficient_or_conflicting_signals(local=9, roaming=2)""], ""carrier_support_local"": [""Chunghwa Telecom: 【現地キャリア利用】台湾で使用できるeSIM、TAIWAN渡航スケジュールに対応する手軽なeSIMカード。キャリア：中華電信 、台湾では信号が広く、ネットワークが安定し、速度が速いです。eSIMのsimカードはプリペイドsimカードと違って、挿入作業不要(iPhone・androidともeSIMのQ"", ""Chunghwa Telecom: サービスプロバイダ 中華電信"", ""Chunghwa Telecom: 台湾SIMカード 4日間 (96時間) 使い放題 4G/5G簡単設定 TiktokとChatGPT対応 中華電信利用で安定通信 日本語説明書付き SIMフリー対応 プリペイドSIMカード ※Galaxyシリーズ端末非対応 台湾 sim 4日"", ""Chunghwa Telecom: 【台湾eSIM】 5日間 高速データ無制限（低速なし）使い放題 実名登録不要 台湾SIMカード｜Chunghwa Telecom公式認証 台湾e-sim sim プリペイドSIM｜即日発行 LINE相談受付中｜TikTokとChatGPTとテザリング対応"", ""Chunghwa Telecom: 【台湾eSIM】4日間完全無制限 高速データ通信（低速なし）5G/4G-LTE 使い放題 実名登録不要 中華電信正規台湾SIM eSIM プリペイドSIM esim taiwan sim ｜当日発行可能｜TikTok·ChatGPT·テザリング対応 ｜台北 高雄 桃園｜旅行・出張・留学"", ""Chunghwa Telecom: 【台湾eSIM】4日間完全無制限 高速データ通信（低速なし）5G/4G-LTE 使い放題 実名登録不要 中華電信正規台湾SIM eSIM プリペイドSIM esim taiwan sim ｜当日発行可能｜TikTok·ChatGPT·テザリング対応 ｜台北 高雄 桃園｜旅行・出張・留学"", ""Chunghwa Telecom: 【台湾eSIM】 5日間 高速データ無制限（低速なし）使い放題 実名登録不要 台湾SIMカード｜Chunghwa Telecom公式認証 台湾e-sim sim プリペイドSIM｜即日発行 LINE相談受付中｜TikTokとChatGPTとテザリング対応"", ""Chunghwa Telecom: 【台湾eSIM】4日間完全無制限 高速データ通信（低速なし）5G/4G-LTE 使い放題 実名登録不要 中華電信正規台湾SIM eSIM プリペイドSIM esim taiwan sim ｜当日発行可能｜TikTok·ChatGPT·テザリング対応 ｜台北 高雄 桃園｜旅行・出張・留学""], ""monthly_sold_count"": [""台湾 TAIWAN eSIMプラン 4日間 完全無制限 4G-LTE 高速データ プリペイドSIM 次に移動 メインコンテンツ この商品について この商品について この商品について 購入オプション 類似商品と比較する ビデオ レビュー キーボードショートカット 検索 Alt + / カート Shift + Alt + C ホーム Shift + Alt + ""], ""review_count"": [""detail_page: (415)""], ""bestseller_rank"": [""Amazon 売れ筋ランキング 家電＆カメラ - 2,583位 ( 家電＆カメラの売れ筋ランキングを見る ) プリペイドSIMカード - 32位""], ""title"": [""台湾 TAIWAN ESIMプラン 4日間 完全無制限 4G-LTE 高速データ 使い放題 当日発行可能 出発前日本テスト用eSIM500MB 台北 高雄 プリペイドSIM 桃園 esim taiwan sim (4日間完全無制限)""]}"
amazon_jp,tw,【Almond SIM】台湾プリペイドSIMカード｜4日間 完全データ無制限 使い放題｜5G/4G-LTE 高速通信｜台北・高雄など 対応｜24時間安心サポート (4日間（24時間×4）),1422,28,,,,,87,1일,1일,4일,local,"{""chunghwa"": true, ""taiwan_mobile"": null, ""fareastone"": null}","{""skt"": null, ""kt"": null, ""lgu"": null}",unlimited,https://www.amazon.co.jp/SIM%E3%80%91%E5%8F%B0%E6%B9%BE%E3%83%97%E3%83%AA%E3%83%9A%E3%82%A4%E3%83%89SIM%E3%82%AB%E3%83%BC%E3%83%89%EF%BD%9C4%E6%97%A5%E9%96%93-%E5%AE%8C%E5%85%A8%E3%83%87%E3%83%BC%E3%82%BF%E7%84%A1%E5%88%B6%E9%99%90-%E9%AB%98%E9%80%9F%E9%80%9A%E4%BF%A1%EF%BD%9C%E5%8F%B0%E5%8C%97%E3%83%BB%E9%AB%98%E9%9B%84%E3%81%AA%E3%81%A9-%E5%AF%BE%E5%BF%9C%EF%BD%9C24%E6%99%82%E9%96%93%E5%AE%89%E5%BF%83%E3%82%B5%E3%83%9D%E3%83%BC%E3%83%88-4%E6%97%A5%E9%96%93%EF%BC%8824%E6%99%82%E9%96%93%C3%974%EF%BC%89/dp/B0GPVSPCXV,B0GPVSPCXV,B0GPVSPCXV,株式会社ビッグコネクト,bigconnectのストアを表示,"{""price_jpy"": [""￥1,422""], ""usage_validity"": [""【日本語マニュアル付】SIMカード有効期限：ご購入してから1年間有効。（未使用の場合）。利用期間は、データを発生した時点から24時間を1日としてカウントされます。出張、留学などのご利用の場合は、数枚分にも適しています。""], ""activation_validity"": [""【Almond SIM】台湾プリペイドSIMカード｜4日間 完全データ無制限 使い放題｜5G/4G-LTE 高速通信｜台北・高雄など 対応｜24時間安心サポート (4日間（24時間×4）)""], ""data_amount"": [""【データプラン】データ通信専用のSIMです。台湾で利用可能なプリペイドSIMカード。※高速データ容量は無制限。完全使い放題プラン、本人確認やSIMカード認証は不要です。本SIMカードは3 in 1サイズに対応しております。切り取り用のガイドに沿って、ご利用端末のSIMサイズに合わせて押し出してご使用ください""], ""network_type"": [""【SKTelecoｍ公式認証】 韓国eSIM 3日間 (72時間) 電話番号付き 超高速データ無制限 最初の5分発信無料(韓国国内) お急ぎの方即時発行可(LINE相談受付中) 有効期限／ご購入日より120日以内 現地空港サポート(SKTelecomローミングセンター) SKテレコム正規品 韓国SIMカードタイプではありません"", ""score: local=3, roaming=1""], ""carrier_support_local"": [""Chunghwa Telecom: 【製品特徴】台湾への渡航スケジュールに合わせて手軽に利用できます。ネットワーク事業者は中華電信で、TAIWANで広範囲にわたる信号と安定したネットワーク、高速な通信速度を提供します。"", ""Chunghwa Telecom: サービスプロバイダ 台湾：中華電信"", ""Chunghwa Telecom: 【台湾 SIM】3日間 (72時間) 高速データ通信無制限 5G/4G 中華電信回線 simフリー端末のみ対応 ピン付き 台湾 simカード (3日間)"", ""Chunghwa Telecom: 【台湾eSIM】4日間完全無制限 高速データ通信（低速なし）5G/4G-LTE 使い放題 実名登録不要 中華電信正規台湾SIM eSIM プリペイドSIM esim taiwan sim ｜当日発行可能｜TikTok·ChatGPT·テザリング対応 ｜台北 高雄 桃園｜旅行・出張・留学"", ""Chunghwa Telecom: 【台湾 SIM】4日間 (96時間) 高速データ通信無制限 5G/4G 中華電信回線 simフリー端末のみ対応 ピン付き 台湾 simカード (4日間)""], ""review_count"": [""detail_page: (28)""], ""bestseller_rank"": [""Amazon 売れ筋ランキング 家電＆カメラ - 5,821位 ( 家電＆カメラの売れ筋ランキングを見る ) プリペイドSIMカード - 87位""], ""title"": [""【Almond SIM】台湾プリペイドSIMカード｜4日間 完全データ無制限 使い放題｜5G/4G-LTE 高速通信｜台北・高雄など 対応｜24時間安心サポート (4日間（24時間×4）)""]}"
amazon_jp,tw,【台湾eSIM】3日間完全無制限 高速データ通信（低速なし）5G/4G-LTE 使い放題 実名登録不要 中華電信正規台湾SIM eSIM プリペイドSIM esim taiwan sim ｜当日発行可能｜TikTok·ChatGPT·テザリング対応 ｜台北 高雄 桃園｜旅行・出張・留学,750,179,,,300,,28,1일,1일,3일,unknown,"{""chunghwa"": true, ""taiwan_mobile"": null, ""fareastone"": null}","{""skt"": null, ""kt"": null, ""lgu"": null}",unlimited,https://www.amazon.co.jp/%E3%80%90%E5%8F%B0%E6%B9%BEeSIM%E3%80%913%E6%97%A5%E9%96%93%E5%AE%8C%E5%85%A8%E7%84%A1%E5%88%B6%E9%99%90%E9%AB%98%E9%80%9F%E3%83%87%E3%83%BC%E3%82%BF%E9%80%9A%E4%BF%A1%EF%BC%88%E4%BD%8E%E9%80%9F%E3%81%AA%E3%81%97%EF%BC%89%E4%B8%AD%E8%8F%AF%E9%9B%BB%E4%BF%A1%E6%AD%A3%E8%A6%8F%E5%8F%B0%E6%B9%BESIM-%E3%83%97%E3%83%AA%E3%83%9A%E3%82%A4%E3%83%89SIM-taiwan-%E3%83%87%E3%83%BC%E3%82%BF%E5%B0%82%E7%94%A8%EF%BD%9C%E7%B7%8A%E6%80%A5%E6%99%82LINE%E9%80%A3%E7%B5%A1%E5%8F%AF%EF%BD%9C%E5%BD%93%E6%97%A5%E7%99%BA%E8%A1%8C%E5%8F%AF%E8%83%BD%EF%BD%9C%E3%83%86%E3%82%B6%E3%83%AA%E3%83%B3%E3%82%B0%E5%AF%BE%E5%BF%9C-%E6%A1%83%E5%9C%92%EF%BD%9C%E6%97%85%E8%A1%8C%E3%83%BB%E5%87%BA%E5%BC%B5%E3%83%BB%E7%95%99%E5%AD%A6/dp/B0F5W5M8X3,B0F5W5M8X3,B0F5W5M8X3,Global Travel SIM Card,onetoneのストアを表示,"{""price_jpy"": [""￥750""], ""usage_validity"": [""【有効期限について】eSIM カードはアクティベーション前の有効期限が 365 日です。アクティベーション後の有効期間は購入した日数と一致し、24 時間を 1 日として計算されます""], ""activation_validity"": [""【台湾eSIM】3日間完全無制限 高速データ通信（低速なし）5G/4G-LTE 使い放題 実名登録不要 中華電信正規台湾SIM eSIM プリペイドSIM esim taiwan sim ｜当日発行可能｜TikTok·ChatGPT·テザリング対応 ｜台北 高雄 桃園｜旅行・出張・留学""], ""data_amount"": [""Amazon.co.jp: 【台湾eSIM】3日間完全無制限 高速データ通信（低速なし）5G/4G-LTE 使い放題 実名登録不要 中華電信正規台湾SIM eSIM プリペイドSIM esim taiwan sim ｜当日発行可能｜TikTok·ChatGPT·テザリング対応 ｜台北 高雄 桃園｜旅行・出張・留学 : 家電＆カメラ""], ""network_type"": [""local_signal: 【チョコSIM 定額（Sプラン）】【中国の電話番号付きでアプリや施設サービスのSMS認証が可能】【データ容量】合計500MB/月【音声】合計20分間/月 データ/音声/SMS付きSIMカード 中国SIM マカオSIM China unicom ※こちらのSIMカードは契約後、毎月の基本料が発生いたします。※2024年11月1日から台湾でのご利用はできなくなり"", ""roaming_signal: 商品の説明 注意事項： 1. eSIMが提供する機能とサービス 現在のeSIMはデータ通信のみサポートしており、音声通話およびSMS機能はサポートしていません。 2. スマートフォンがeSIMをサポートしているかどうかの確認方法 「通話」画面で`*#06#`を入力すると、EID情報が表示されます。これはスマートフォンがeSIMのインストールをサポートしている"", ""insufficient_or_conflicting_signals(local=6, roaming=3)""], ""carrier_support_local"": [""Chunghwa Telecom: サービスプロバイダ Chunghwa Telecom"", ""Chunghwa Telecom: Amazon.co.jp: 【台湾eSIM】3日間完全無制限 高速データ通信（低速なし）5G/4G-LTE 使い放題 実名登録不要 中華電信正規台湾SIM eSIM プリペイドSIM esim taiwan sim ｜当日発行可能｜TikTok·ChatGPT·テザリング対応 ｜台北 高雄 桃園｜旅"", ""Chunghwa Telecom: 【台湾eSIM】3日間完全無制限 高速データ通信（低速なし）5G/4G-LTE 使い放題 実名登録不要 中華電信正規台湾SIM eSIM プリペイドSIM esim taiwan sim ｜当日発行可能｜TikTok·ChatGPT·テザリング対応 ｜台北 高雄 桃園｜旅行・出張・留学"", ""Chunghwa Telecom: 【台湾eSIM】4日間完全無制限高速データ通信（低速なし）中華電信正規台湾SIM eSIM プリペイドSIM esim taiwan sim 5G/4G-LTE データ専用｜緊急時LINE連絡可..."", ""Chunghwa Telecom: 【台湾eSIM】4日間完全無制限高速データ通信（低速なし）中華電信正規台湾SIM eSIM プリペイドSIM esim taiwan sim 5G/4G-LTE データ専用｜緊急時LINE連絡可..."", ""Chunghwa Telecom: 【台湾eSIM】3日間完全無制限 高速データ通信（低速なし）5G/4G-LTE 使い放題 実名登録不要 中華電信正規台湾SIM eSIM プリペイドSIM esim taiwan sim ｜当日発行可能｜TikTok·ChatGPT·テザリング対応 ｜台北 高雄 桃園｜旅行・出張・留学"", ""Chunghwa Telecom: 【台湾eSIM】 3日間 高速データ無制限（低速なし）使い放題 実名登録不要 台湾SIMカード｜Chunghwa Telecom公式認証 台湾e-sim sim プリペイドSIM｜即日発行 LINE相談受付中｜TikTokとChatGPTとテザリング対応"", ""Chunghwa Telecom: 【台湾eSIM】3日間完全無制限 高速データ通信（低速なし）5G/4G-LTE 使い放題 実名登録不要 中華電信正規台湾SIM eSIM プリペイドSIM esim taiwan sim ｜当日発行可能｜TikTok·ChatGPT·テザリング対応 ｜台北 高雄 桃園｜旅行・出張・留学"", ""Chunghwa Telecom: Amazon.co.jp: 【台湾eSIM】3日間完全無制限 高速データ通信（低速なし）5G/4G-LTE 使い放題 実名登録不要 中華電信正規台湾SIM eSIM プリペイドSIM esim taiwan sim ｜当日発行可能｜TikTok·ChatGPT·テザリング対応 ｜台北 高雄 桃園｜旅""], ""monthly_sold_count"": [""Amazon.co.jp: 【台湾eSIM】3日間完全無制限 高速データ通信（低速なし）5G/4G-LTE 使い放題 実名登録不要 中華電信正規台湾SIM eSIM プリペイドSIM esim taiwan sim ｜当日発行可能｜TikTok·ChatGPT·テザリング対応 ｜台北 高雄 桃園｜旅行・出張・留学 : 家電＆カメラ 次に移動 メインコンテンツ""], ""review_count"": [""detail_page: (179)""], ""bestseller_rank"": [""Amazon 売れ筋ランキング 家電＆カメラ - 2,517位 ( 家電＆カメラの売れ筋ランキングを見る ) プリペイドSIMカード - 28位""], ""title"": [""【台湾eSIM】3日間完全無制限 高速データ通信（低速なし）5G/4G-LTE 使い放題 実名登録不要 中華電信正規台湾SIM eSIM プリペイドSIM esim taiwan sim ｜当日発行可能｜TikTok·ChatGPT·テザリング対応 ｜台北 高雄 桃園｜旅行・出張・留学""]}"
